Nom;GPS
Lycée Felix Esclangon (Manosque - 04);43.8368,5.78122
Université Paris Dauphine - Campus de Madrid (Espagne);40.3957,-3.68591
Sciences Po Lyon – Institut d'études politiques (Lyon 7e  Arrondissement - 69);45.747,4.8358
Lycée La Plaine Monceau (Paris  8e  Arrondissement - 75);48.8809,2.31598
Centre National de Danse Contemporaine (Angers - 49);47.4728,-0.56494
MFREO Les Dronières à Cruseilles (74);46.03737,6.11941
ASSOCIATION DE FORMATION AUX PROFESSIONS PARA-MEDICALES (Berck - 62);50.3996,1.56053
Lycée professionnel Saint-Jean De Montmartre (Paris 18e  Arrondissement - 75);48.8881,2.33371
INSTITUT DE  FORMATION DE TECHNICIENS DE LABORATOIRE MEDICAL (IFTLM) UFR SANTE (Amiens - 80);49.8908,2.29318
INSTITUT PEDICURIE PODOLOGIE REGION SANITAIRE DE LILLE (59);50.6283,3.03956
IRCOM LYON (Lyon 1er Arrondissement - 69);45.77,4.82012
Ecole de management de Normandie - Campus de Caen (14);49.2109,-0.35659
École supérieure d’art et de communication de Cambrai (59);50.1885,3.24329
Ecole Supérieure d'Art de Clermont Métropole (Clermont-Ferrand - 63);45.7684,3.0869
MONTPELLIER CONTEMPORAIN Ecole Supérieure des Beaux -Arts (34);43.61738,3.88408
Ecole des Beaux-Arts Nantes Saint-Nazaire (44);47.2066,-1.56032
École supérieure des beaux-arts de Nîmes (30);43.8377,4.36161
ECOLE SUPERIEURE D'ART ET DE DESIGN DE REIMS (51);49.2523,4.02969
ECOLE DU LOUVRE (Paris  1er Arrondissement - 75);48.8609,2.33094
Lycée Saint André (Ottange - 57);49.4404,6.01775
ECOLE DU CENTRE DRAMATIQUE NATIONAL DE SAINT ETIENNE (42);45.4517,4.39191
Ecole Européenne Supérieure d'Art de Bretagne - Site de Lorient (56);47.73553,-3.36527
KEDGE BUSINESS SCHOOL - Site de Toulon-La Garde (83);43.1276,5.92738
KEDGE BUSINESS SCHOOL - Site de Bastia (Borgo - 20);42.589,9.43472
Haute école des arts du Rhin - Site d'arts plastiques de Mulhouse (68);47.74385,7.32706
IETP de Hoymille (59);50.9729,2.46109
Lycée professionnel Marc Seguin (Annonay - 07);45.24485,4.67538
CREPS Pays de la Loire - Antenne de Sable sur Sarthe (72);47.8379,-0.33257
CFA CAMPUS DE GAP (05);44.5386,6.05906
Lycée professionnel Domaine D Eguilles (Vedène - 84);43.983,4.89966
ISRP (Marseille  9e  Arrondissement - 13);43.2595,5.41162
CFA du lycée agricole de Laval (53);48.0496,-0.79497
Lycée agricole Campus - Lycee Technologique Charles Peguy (Clisson - 44);47.105,-1.30126
CFA SUP DE VENTE (Saint-Germain-en-Laye - 78);48.8959,2.07147
Institut du travail social de Pau (site de Mont-de-Marsan) (64);43.3156,-0.37106
CFA MATHIS (Schiltigheim - 67);48.6108,7.76755
Lycée professionnel Sevigne (Gap - 05);44.5621,6.07447
Polytech Montpellier BIO (34);43.6313,3.86108
EEIGM Nancy - Groupe INP (54);48.6954,6.19324
IMT Lille Douai (Villeneuve-d'Ascq - 59);50.6105,3.13445
Polytech Annecy-Chambéry (74);45.9197,6.15774
INSA Centre Val de Loire (Blois - 41);47.5844,1.32571
INSA Rennes (35);48.1237,-1.63536
Polytech Angers - IUT d'Angers - Génie Electrique et Informatique Industrielle (49);47.4816,-0.60209
Polytech Nantes - IUT de Nantes - Génie Electrique et Informatique Industrielle (Carquefou - 44);47.298,-1.50139
Cursus Humanités et technologie UTC Université de Technologie de Compiègne (60);49.4148,2.81788
Grenoble Ecole de Management (38);45.1902,5.71309
Polytech Marseille - IUT de Marseille - Réseaux et Télécom (13);43.2327,5.44202
Polytech Marseille - IUT de Marseille - Chimie (13);43.2327,5.44202
ISEN Ouest Nantes Cycle informatique et réseaux (Carquefou - 44);47.2749,-1.50702
Sup'Enr - Partenaire INSA (Perpignan - 66);42.6841,2.89855
INSSET de Saint-Quentin (02);49.8495,3.28748
Lycée agricole La Thierache (Fontaine-lès-Vervins - 02);49.8324,3.88659
Lycée Madame De Stael (Montluçon - 03);46.3415,2.60199
LEGTPA du Bourbonnais / Site de Moulins (03);46.5482,3.28773
Lycée Alexandra David Neel (Digne-les-Bains - 04);44.1003,6.23382
Lycée Sasserno (Nice - 06);43.7024,7.27063
L.E.G.T.A. de Pamiers (09);43.1284,1.65426
Lycée agricole Charles Baltet (Saint-Pouange - 10);48.2352,4.0464
Lycée Notre Dame De Sion (Marseille  6e  Arrondissement - 13);43.2828,5.3814
Lycée agricole Aix-Valabre (Gardanne - 13);43.4684,5.45022
IUT Aix-Marseille - Site de la Ciotat (13);43.1733,5.60437
Lycée Charles-De-Gaulle (Caen - 14);49.1841,-0.37936
Lycée Edouard Vaillant (Vierzon - 18);47.2281,2.06758
Université d'Orléans - Collegium Droit - Antenne de Bourges (18);47.0851,2.39925
CFA Beaune VITICOLE (21);47.0257,4.83098
Lycée Eugène JAMOT (Aubusson - 23);45.9536,2.16711
ENIL (Mamirolle - 25);47.1969,6.16269
UFA Lycée du Valentin - CFA Public Agricole Régional (Bourg-lès-Valence - 26);44.9524,4.89132
Lycée Léopold Sédar Senghor (Evreux - 27);49.0082,1.13966
Lycée Le Caousou (Toulouse - 31);43.6011,1.46111
Lycée de la photographie - ETPA (Auzeville-Tolosane - 31);43.5292,1.48948
CFAA Piémont-Pyrénées EPLA de St-Gaudens (Saint-Gaudens - 31);43.117,0.73068
Campus La Salle St Christophe (Masseube - 32);43.4297,0.57979
Lycée Camille Jullian (Bordeaux - 33);44.8446,-0.59018
Lycée Francois Mauriac (Bordeaux - 33);44.8392,-0.55548
Lycée agricole de Bordeaux Blanquefort (33);44.9161,-0.63598
CPBx (ENSCBP département Sciences et Techniques des Aliments) (Pessac - 33);44.8007,-0.61088
CFA IFRIA AQUITAINE (Talence - 33);44.805,-0.60959
Ecole Nationale Supérieure d'Architecture de Montpellier (34);43.6365,3.85694
Lycée St Joseph Pierre Rouge (Montferrier-sur-Lez - 34);43.6784,3.87317
Lycée Saint-Joseph (Sète - 34);43.4036,3.6933
Lycée Jean Mace (Rennes - 35);48.1172,-1.67124
Lycée professionnel Agricole Edmond Michelet (Fougères - 35);48.3675,-1.20843
ANTENNE CFAA - Groupe Antoine de St Exupéry - site Etrelles (Vitré - 35);48.1191,-1.20363
I.U.T de Chateauroux - Antenne d'Issoudun (36);46.9492,2.00281
I.U.T. de Châteauroux (36);46.8112,1.68466
Lycée professionnel Victor Laloux (Tours - 37);47.3581,0.70199
Lycée Victor Duruy (Mont-de-Marsan - 40);43.899,-0.50026
CFA FORESTIER REGIONAL (Bazas - 33);44.433,-0.22371
Antenne de Montoire du CFA du Loir et Cher (Montoire-sur-le-Loir - 41);47.7505,0.87576
Lycée général et technologique Grand Air (La Baule-Escoublac - 44);47.2868,-2.37445
Ecole Nationale Supérieure d'Architecture de Nantes (44);47.2075,-1.55711
Lycée St Joseph (Ancenis-Saint-Géréon - 44);47.3666,-1.17945
Lycée Blanche De Castille (Nantes - 44);47.2372,-1.53331
Lycée Technologique Notre-Dame d'Espérance (Saint-Nazaire - 44);47.2745,-2.20785
Lycée Bernard Palissy (Gien - 45);47.6981,2.62476
Lycée Maurice Genevoix (Ingré - 45);47.9208,1.83119
Lycée agricole Armand FALLIERES Nérac (47);44.1094,0.3701
CFA DE LA LOZERE Site de Marvejols (48);44.5553,3.29251
Lycée Victor Grignard (Cherbourg-en-Cotentin - 50);49.6386,-1.62905
Lycée Fredéric OZANAM (Châlons-en-Champagne - 51);48.9782,4.36062
Lycée Edme Bouchardon (Chaumont - 52);48.1048,5.14785
Institut d'Informatique Appliquée (Saint-Berthevin - 53);48.0634,-0.81198
Lycée Jacques Marquette (Pont-à-Mousson - 54);48.9062,6.05744
Lycée Louis Bertrand (Val de Briey - 54);49.2485,5.93668
CFAA de de Meurthe et Moselle (Malzéville - 54);48.7305,6.18038
Lycée Jacques-Marie Boutet De Monvel (Lunéville - 54);48.5987,6.49251
CFA Blaise Pascal (Forbach - 57);49.18,6.89494
Lycée Felix Mayer (Creutzwald - 57);49.1991,6.69759
Lycée Saint Vincent De Paul (Algrange - 57);49.3577,6.04936
LYCEE GEN.ET TECHNOL.PRIVE LYCEE PRIVE ST ETIENNE (Metz - 57);49.0667,6.15244
Lycée Louis Pasteur (Somain - 59);50.3495,3.28268
Institution Saint Jude (Armentières - 59);50.6873,2.87485
Lycée Depoorter (Hazebrouck - 59);50.7205,2.53334
Institut d'Hazebrouck (59);50.721,2.52906
Lycée INTERNATIONAL MONTEBELLO (Lille - 59);50.6196,3.04807
Université d'Artois - Site de Douai (59);50.3694,3.0739
Lycée Jeanne Hachette (Beauvais - 60);49.4358,2.08124
Lycée CHARLES DE GAULLE (Compiègne - 60);49.4178,2.82614
Lycée Diderot (Carvin - 62);50.491,2.94711
Lycée professionnel Agricole Sainte Marie (Aire-sur-la-Lys - 62);50.6377,2.40591
IUT LITTORAL (SAINT OMER) (62);50.7371,2.2599
CPI Clermont-Ferrand (Sigma Clermont) (Aubière - 63);45.7512,3.11068
Lycée professionnel Sixte Vignon (Aureilhan - 65);43.2463,0.08485
Université de Strabourg (dispensée au lycée Jean Rostand à Strasboug) (Strasbourg - 67);48.5774,7.73948
Ecole Nationale Supérieure d'Architecture de Strasbourg (67);48.5862,7.73732
Lycée professionnel Marie Antoinette Riess (Mazamet - 81);43.5024,2.38001
Lycée Edouard Delamare Deboutteville (Forges-les-Eaux - 76);49.6178,1.53613
ICN BUSINESS SCHOOL (Nancy - 54);48.6737,6.16975
Lycée Aristide Briand (Gap - 05);44.5659,6.08379
Lycée professionnel Sainte Marie (Saint-Etienne - 42);45.4408,4.39536
Sorbonne Université – Médecine (Paris 13e  Arrondissement - 75);48.8376,2.3604
MFR de Songeons (60);49.5492,1.85371
MFR de la Capelle (02);49.97608,3.91826
IPAC ALBERTVILLE (73);45.6666,6.39264
Lycée professionnel Schattenmann (Bouxwiller - 67);48.8275,7.47823
Ecole Universitaire de premier cycle - Campus de Guyancourt Université de Paris-Saclay (78);48.7803,2.04397
Lycée professionnel Alfred De Musset (Villeurbanne - 69);45.7559,4.91874
Audencia Business School - Campus Vendée (La Roche-sur-Yon - 85);46.6571,-1.4309
Centre de Ressources, d’Expertise et de Performance Sportive d’Auvergne Rhône-Alpes Vallon-Pont-d'Arc (CREPS) (07);44.3987,4.38954
Ecole Nationale Supérieure d'Art Dramatique de Montpellier Languedoc-Roussillon (34);43.6135,3.87506
CAPFORMA/Annexe CFA Régional Interconsulaire Méditerranée - Toulon (83);43.151,6.04503
CFA BATIPOLE VTP DROME ARDECHE (Livron-sur-Drôme - 26);44.7683,4.83998
CFAI - FEIGNIES - Antenne de FEIGNIES (59);50.2768,3.90813
ECAM Arts et Métiers - Ingénieur Généraliste / ECAM Strasbourg-Europe (67);48.60908,7.70527
ECAM Rennes - Ingénieur Généraliste  (35);48.04693,-1.74329
ECAM-EPMI - Ingénieur Généraliste / Grasse (06);43.6573,6.9311
ECAM Arts et Métiers - Ingénieur Généraliste / ECAM Lyon / site de Lasalle Passy Buzenval (Rueil-Malmaison - 92);48.8588,2.18322
Ingénieur UniLaSalle / Rouen (Mont-Saint-Aignan - 76);49.4673,1.07273
EFREI Paris Prépa classique - Campus Paris Sud ou Bordeaux (Villejuif - 94);44.79508,-0.60571
Lycée professionnel Louis Bleriot (Trappes - 78);48.777,1.98035
CFA MFR MAISON FAMILIALE (Ormoy-la-Rivière - 91);48.3982,2.14441
ESTP - Campus de Troyes (Rosières-près-Troyes - 10);48.26582,4.08021
Lycée professionnel Sainte Bernadette (Jeumont - 59);50.2955,4.10067
AFTRAL CFA TL Aulnay-Sous-Bois (93);48.9583,2.46603
Groupe Alternance Blois (41);47.60603,1.32901
ARIFTS PAYS DE LA LOIRE - REZE (44);47.1888,-1.56632
Lycée Jacques Ruffié (Limoux - 11);43.0508,2.21948
CODEV (Aix-en-Provence - 13);43.5149,5.43331
AFTRAL CFA Transport Logistique - site de Dourges Hénin-Beaumont  (62);50.4591,2.97807
AFTRAL- CFA TRANSPORT ET LOGISTIQUE - Site d'Amiens (80);49.8941,2.29575
C.F.A.T.L. AFTRAL (Paris 11e  Arrondissement - 75);48.8543,2.3777
Négociance Business School (Metz - 57);49.1012,6.21547
Lycée professionnel Andre Malraux (Montataire - 60);49.2608,2.42532
CFA du Pays d'Aix (Aix-en-Provence - 13);43.52792,5.41868
Lycée professionnel Saint-Dominique (Albi - 81);43.9298,2.1477
CFA ACADEMIQUE (Jaunay-Marigny - 86);46.68223,0.36282
Lycée professionnel Le Sidobre (Castres - 81);43.5959,2.23705
Lycée Jeanne Delanoue (Cholet - 49);47.064,-0.86785
Lycée professionnel Edouard Branly (La Roche-sur-Yon - 85);46.6742,-1.44276
CFA Alternance Champagne Ardenne (Reims - 51);49.23565,4.06677
Alliance européenne (Périgueux - 24);45.1838,0.71611
Lycée Sacre-Coeur (Amiens - 80);49.8932,2.30511
Lycée professionnel Simone VEIL (Angers - 49);47.44894,-0.5513
Lycée professionnel Paul Emile Victor (Avrillé - 49);47.5003,-0.58839
Lycée professionnel Saint Joseph De Cluny (Mulhouse - 68);47.7509,7.347
Lycée professionnel JEAN-PAUL II (Denain - 59);50.3224,3.38196
Lycée du Haut-Barr (Saverne - 67);48.731,7.35387
CPI Strasbourg (ECPM) (67);48.6079,7.71566
Lycée Saint-Andre (Colmar - 68);48.08,7.35941
Ecole Nationale Supérieure d'Architecture de Lyon (Vaulx-en-Velin - 69);45.7795,4.92351
Lycée Chevreul Lestonnac (Lyon 7e  Arrondissement - 69);45.7701,4.8217
MFR-IR de Bernay en Champagne (Bernay-Neuvy-en-Champagne - 72);48.078,-0.06995
Lycée Vaugelas (Chambéry - 73);45.5674,5.91807
Lycée des Glieres (Annemasse - 74);46.188,6.2431
Lycée Sophie Germain (Paris  4e  Arrondissement - 75);48.8549,2.35816
Lycée Rodin (Paris 13e  Arrondissement - 75);48.8324,2.34723
CFA CODIS COMMERCE DISTRIBUTION SERVICES (Paris 10e  Arrondissement - 75);48.8751,2.35261
Ecole Nationale Supérieure d'Architecture de Paris-Val de Seine (Paris 13e  Arrondissement - 75);48.8274,2.38517
Lycée Claude Monet (Le Havre - 76);49.5016,0.109
Lycée Georges Brassens (Neufchâtel-en-Bray - 76);49.7376,1.43837
Lycée professionnel Louis Lumiere (Chelles - 77);48.8797,2.61209
Lycée George Sand (Le Mée-sur-Seine - 77);48.5499,2.63621
Lycée Honore De Balzac (Mitry-Mory - 77);48.9718,2.6494
Lycée Rene Descartes (Champs-sur-Marne - 77);48.8445,2.58584
Lycée Jean Vilar (Plaisir - 78);48.8242,1.95909
I.U.T de Velizy (Vélizy-Villacoublay - 78);48.7826,2.21773
Lycée Louis Bascan (Rambouillet - 78);48.6397,1.82486
Lycée Saint Joseph (Bressuire - 79);46.8378,-0.49022
Lycée Madeleine Michelis (Amiens - 80);49.8892,2.30387
Lycée Jean Racine (Montdidier - 80);49.6538,2.581
Lycée Jeanne D'Arc (Mazamet - 81);43.4845,2.37453
Lycée Frédéric Mistral (Avignon - 84);43.9471,4.80157
Lycée agricole Lucon-Petre (Sainte-Gemme-la-Plaine - 85);46.4148,-1.03476
CFA de la Vienne Antenne de Thuré (86);46.8351,0.4567
Université de Lorraine - Faculté Droit Sciences économiques Gestion - Site d'Epinal (88);48.1754,6.4525
Lycée Gustave Courbet (Belfort - 90);47.6523,6.85612
Lycée agricole Lucien Quelet (Valdoie - 90);47.6781,6.84008
Lycée Marcel Pagnol (Athis-Mons - 91);48.6978,2.37824
Lycée Guy De Maupassant (Colombes - 92);48.9287,2.24216
Lycée Montalembert (Courbevoie - 92);48.9031,2.27611
EREA Toulouse Lautrec (Vaucresson - 92);48.8439,2.15781
Lycée Louise Michel (Bobigny - 93);48.9021,2.44076
Pôle Chateaubriand - Joliot-Curie (Rennes - 35);48.1241,-1.65012
Lycée Giocante De Casabianca (Bastia - 20);42.7033,9.44467
Lycée professionnel Paul Lacave (Capesterre-Belle-Eau - 971);16.051,-61.5625
Lycée Victor Schoelcher (Fort-de-France - 972);14.6029,-61.0765
Lycée Joseph Zobel (Rivière-Salée - 972);14.5132,-60.9659
Lycée Leon-Gontran Damas (Remire-Montjoly - 973);4.88273,-52.2869
Lycée Jean Joly (Saint-Louis - 974);-21.2635,55.4373
Lycée Mahatma gandhi (Saint-André - 974);-20.9758,55.6518
AGROCAMPUS OUEST Angers (49);47.4778,-0.60653
Ecole supérieure d'art et de design d'Orléans (45);47.9027,1.9104
EGC Agen Sud Management (47);44.167,0.59544
EGC de Brive (Brive-la-Gaillarde - 19);45.1546,1.533
Lycée professionnel Charles Peguy (Eysines - 33);44.8885,-0.6268
Lycée Professionnel Agricole d'Horticulture et du Paysage La Mouillère (Orléans - 45);47.882,1.91024
Lycée Lumina Sophie (Saint-Laurent-du-Maroni - 973);5.48388,-54.0249
CESI Ecole d'ingénieurs - Saint Nazaire (44);47.2524,-2.25752
Lycée professionnel Amyot D Inville (Senlis - 60);49.1915,2.56918
Lycée professionnel Flora Tristan (Camblanes-et-Meynac - 33);44.7654,-0.49211
Lycée professionnel agricole de Saint Yrieix la Perche (87);45.5117,1.24896
Polytech Sorbonne (Paris  5e  Arrondissement - 75);48.8451,2.35695
CTR DE FORMATION D APPRENTIS JEAN BOSCO INST.PROF. ST LOUIS (Guînes - 62);50.8697,1.86884
Lycée Nelson Mandela (Poitiers - 86);46.5984,0.32943
Lycée professionnel Fernand Leger (Bédarieux - 34);43.6115,3.16762
Lycée Saint-Joseph (Marvejols - 48);44.5557,3.29041
Bachelor ESC PAU (64);43.3177,-0.3643
CFA LE CORBUSIER (Illkirch-Graffenstaden - 67);48.5298,7.72511
CFA du lycée Paul Emile Victor (Obernai - 67);48.4632,7.49131
MFR La Vernée à Peronnas (01);46.1721,5.177
Lycée professionnel Boc-Calmet (Pointe-à-Pitre - 971);16.2377,-61.534
I.U.T du Limousin - Site de Guéret (23);46.1725,1.86375
Centre de Formation d'Apprentis Régional de Don Bosco (Nice - 06);43.7095,7.28104
Lycée Bourg-Chevreau Ste Anne (Segré-en-Anjou Bleu - 49);47.6811,-0.87156
Lycée du Couserans (Saint-Girons - 09);42.9781,1.15164
Lycée professionnel Fernand Degrugillier (Auchel - 62);50.5054,2.46675
ESCEM Orléans (45);47.9072,1.89061
CFA ECR (Sainte-Marie - 974);-20.8941,55.5332
MFR de CORMARANCHE (Cormaranche-en-Bugey - 01);45.9578,5.60105
CFA BATIMENT D''ILLE ET VILAINE (Saint-Grégoire - 35);48.1603,-1.69311
Technopolys  (La Motte-Servolex - 73);45.5981,5.88474
CFA PROPRETE DE L''INHNI (Pessac - 33);44.7873,-0.64967
FACULTE DES METIERS CFA MUNICIPAL DE LA VILLE DE CANNES (Cannes La Bocca - 06);43.5536,6.96667
INSTITUT NEMO (Paris  8e  Arrondissement - 75);48.8244,2.3477
CREATECH (Roanne - 42);46.0369,4.08019
Lycée André Alquier à St Amans Soult (Saint-Amans-Soult - 81);43.4877,2.46439
Lycée Drôme Provençale (Saint-Paul-Trois-Châteaux - 26);44.3432,4.76689
CFA ARCNAM (Lille - 59);50.6284,3.07154
Antenne AFTRAL CFA TL (VAULX EN VELIN) (69);45.7463,4.93266
CFA PHARMACIE J BRUDON ACPPAV (Poissy - 78);48.9478,2.06373
BTP CFA EURE-ET-LOIR (Chartres - 28);48.4312,1.50233
Facultés libres de l'ouest - UCO - Brest (29);48.3904,-4.48608
CFA INTERPROF CH MET LOIRET (Orléans - 45);47.9008,1.92412
Lycée Emilie du Châtelet (Serris - 77);48.8575,2.77846
EGC de Nîmes (30);43.8329,4.36835
CFA-EN Pierre Mendès France (Rennes - 35);48.134,-1.68403
Lycée professionnel agricole Louis Mallet (Saint-Flour - 15);45.0241,3.06907
INSTA (Paris  2e  Arrondissement - 75);48.8676,2.34524
CFA EST-LOIRET (Montargis - 45);47.9938,2.72915
Lycée professionnel Jean Perrin (Saint-André - 974);-20.9629,55.6537
Lycée professionnel Colbert (Marseille  7e  Arrondissement - 13);43.2881,5.35714
Institut de Formation de Manipulateurs d'Electroradiologie du CHU de Rennes (IFMEM) (35);48.1205,-1.69561
ECOLE MANIPUL.ELECTRO-RADIOL. CENTRE HOSPITALIER REGIONAL (Poitiers - 86);46.5589,0.38491
Ecole Supérieure d'Art et Design Le Havre-Rouen (ESADHaR) site du Havre (76);49.4975,0.13228
Maison Familiale Auxois Sud-Morvan (Liernais - 21);47.2052,4.28094
CFA interprofessionnel du CNAM (Nancy - 54);48.6816,6.19053
Lycée professionnel Florian (Sceaux - 92);48.7815,2.30347
Lycée professionnel Jean Guehenno (Vannes - 56);47.6595,-2.7826
CFA AFORP METIERS DE LA MECANIQUE AFORP (Asnières-sur-Seine - 92);48.9116,2.28402
LGT ROBERT WEINUM St Martin (Saint-Martin - 971);18.0953,-63.0637
Lycée des métiers Jacques Brel (Lormont - 33);44.8762,-0.51149
Maison Familiale et Rurale de Semur en Auxois (21);47.494,4.33298
Porte Du Lot Lycee Des Metiers Des Maintenances Des Engins De Travaux Publics Et Des Machines Agricoles (Clairac - 47);44.3017,0.33866
Lycée De L'Albanais (Rumilly - 74);45.8694,5.93444
CFA académique - UFA André Voisin site Pablo Neruda (Dieppe - 76);49.9195,1.08303
CFA DU BATIMENT ET TP Henri Neyer (Auxerre - 89);47.8097,3.58109
Université de Poitiers (Site d'Angoulême) (La Couronne - 16);45.6257,0.12156
NELSON MANDELA (Marseille 12e  Arrondissement - 13);43.2977,5.42795
EiSINe - Reims (51);49.2412,4.06398
Centre de Ressources, d'Expertise et de Performance Sportive Antilles-Guyane (CREPS) (Les Abymes - 971);16.2649,-61.513
Institut Sainte-Genevieve (Paris  6e  Arrondissement - 75);48.8459,2.33125
Lycée André Malraux - DNMADE - Graphisme - Spécialité : Illustration (Montereau-Fault-Yonne - 77);48.3932,2.95877
ECOLE SUPERIEURE PRIVEE CPES - CENTRE IPRESS (Toulouse - 31);43.6003,1.4473
EC.SECONDAIRE ET TECHN.PRIVEE VIDAL (Toulouse - 31);43.5934,1.41894
CFAI de l’AFIL Loire-Drôme-Ardèche - site de Mably (42);46.066,4.07344
Lycée professionnel Challes Les Eaux (73);45.5501,5.98283
MFR de Mareuil sur Lay (Mareuil-sur-Lay-Dissais - 85);46.5382,-1.22285
EFREI Paris Prépa biologie et numérique (Villejuif - 94);48.7897,2.36385
Université Paris 1 Panthéon Sorbonne / Université Sorbonne Nouvelle Paris 3 (Paris  5e  Arrondissement - 75);48.82728,2.36463
IFSI CH Briançon - rentrée en septembre (05);44.8948,6.63437
I.F.S.I. BLANCARDE - rentrée en septembre (Marseille  3e  Arrondissement - 13);43.3057,5.36614
IFSI Hop Ste Marguerite - rentrée en septembre (Marseille  9e  Arrondissement - 13);43.2292,5.31627
IFSI CROIX ROUGE FRANCAISE LAVAL - rentrée en septembre (53);48.079,-0.78476
IFSI CH Nord Mayenne - rentrée en février (53);48.3048,-0.61005
IFSI Croix Rouge Française Ollioules - rentrée en septembre (83);43.1303,5.87607
IFSI VAROIS ST-RAPHAEL - rentrée en septembre (Saint-Raphaël - 83);43.43238,6.76862
Institut de Formation en Soins Infirmiers - SAINT-QUENTIN - rentrée en septembre (02);49.86052,3.26889
Institut de Formation en Soins Infirmiers - CHAUNY - rentrée en septembre (02);49.62503,3.23444
IFSI du CHU Dijon - rentrée en septembre (21);47.32204,5.07238
IFSI CH Nevers - rentrée en septembre (58);46.9907,3.14373
IFSI CH Montceau Les Mines  - rentrée en septembre (71);46.6474,4.33196
IFSI Croix Rouge Française Alençon - rentrée en septembre (61);48.4236,0.08621
IFSI CH Dole - rentrée en septembre (39);47.09953,5.49692
IFSI Croix Rouge Française Lons Le Saunier - rentrée en septembre (39);46.67633,5.55046
IFSI CHU Grenoble Alpes - rentrée en septembre (38);45.1914,5.76288
IFSI CHU Réunion St Denis - rentrée en septembre (Saint-Denis - 974);-20.8882,55.4448
IFSI Croix Rouge Française Calais - rentrée en septembre (62);50.9462,1.86303
IFSI La Croix-Rouge Française Dechy - rentrée en septembre (59);50.33623,3.1022
IFSI de Vienne - rentrée en septembre (38);45.5357,4.87861
Ecole Santé Social Sud-Est - rentrée en septembre (Lyon 9e  Arrondissement - 69);45.7799,4.80549
IFSI CH LA ROCHE-SUR-YON - rentrée en septembre (85);46.67642,-1.39971
IFSI Chaumont - rentrée en septembre (52);48.1208,5.13999
IFSI Mulhouse - rentrée en septembre (68);47.72821,7.34655
IFSI CH Rodez - rentrée en septembre (12);44.3602,2.55441
IFSI CHU de Toulouse - rentrée en septembre (31);43.6017,1.4038
IFSI CH Vierzon - rentrée en septembre (18);47.22935,2.04454
IFSI CH de Chateaudun - rentrée en septembre (28);48.0629,1.33517
IFSI CH Marc Jacquet Melun - rentrée en septembre (77);48.5413,2.66999
I.F.S.I. du centre hospitalier du sud Seine-et-Marne (Montereau) - rentrée en septembre (Fontainebleau - 77);48.425,2.74109
IFSI Henri Mondor (AP-HP) - rentrée en septembre (Créteil - 94);48.7981,2.45248
IFSI Charles Foix (AP-HP) - rentrée en septembre (Ivry-sur-Seine - 94);48.80525,2.39669
IFSI Léonie Chaptal - rentrée en septembre (Sarcelles - 95);48.9823,2.39167
IFSI CH André Mignot Versailles - rentrée en septembre (78);48.8164,2.12401
IFSI du CH de Rambouillet - rentrée en septembre (78);48.6438,1.83194
MFREO de Châteauneuf sur Isère (26);45.0158,4.93805
IFSI CH Guillaume Régnier - rentrée en septembre (Rennes - 35);48.1165,-1.64525
IFSI Quimper - rentrée en septembre (29);47.9963,-4.09297
Université Clermont Auvergne - Antenne de Vichy - UFR STAPS (03);46.1196,3.42528
Lycée professionnel maritime et aquacole (Le Portel - 62);50.7198,1.5864
EGC de Montauban (82);44.0203,1.35957
MFREO de Gionges (51);48.9356,3.97551
INSTITUT DE FORMATION SOCIALE DES YVELINES (Versailles - 78);48.8168,2.12378
IFSI CHU Bordeaux - rentrée en septembre (Pessac - 33);44.80181,-0.6344
IFSI CH Villeneuve Sur Lot - rentrée en septembre (47);44.4069,0.71201
Lycée Pierre Brossolette (Le Kremlin-Bicêtre - 94);48.8149,2.35963
CFA du lycée agricole Nature La Roche sur Yon (85);46.6648,-1.38076
CFA de l'Eure horticole (Evreux - 27);49.0088,1.14895
Polytech Lyon : Université Jean Monnet - Campus de Roanne - Licence Sciences pour l'Ingénieur (42);46.0439,4.0717
Polytech Nantes - IUT de La Roche sur Yon - Réseaux et Télécommunications (85);46.6771,-1.40498
Lycée professionnel Jean Mace (Fameck - 57);49.3024,6.1144
ASSO FORMAT BIOCHIM BIOL ECOLE (Paris  9e  Arrondissement - 75);48.88244,2.34566
Lycée professionnel des métiers (Pont-de-Buis-lès-Quimerch - 29);48.2517,-4.09186
ECOLE TECHNOLOGIQUE PRIVÉE Hall 32 (Clermont-Ferrand - 63);45.7902,3.10521
Lycée Blomet (Paris 15e  Arrondissement - 75);48.844,2.30891
Lycée Cité scolaire de Bandrélé (Chirongui - 976);-12.9143,45.1953
Lycée professionnel maritime Public (Saint-Malo - 35);48.6556,-1.96925
Lycée André Malraux - DNMADE - Graphisme - Spécialité : Edition (Montereau-Fault-Yonne - 77);48.3932,2.95877
Icam Site de Lille - Parcours 2+3 en apprentissage (59);50.6301,3.03978
Icam Site de Toulouse - Parcours ouvert (31);43.59749,1.41488
CFA PROMOTRANS (Bruz - 35);48.0503,-1.74443
Site de St Germain en Laye du CFA des Yvelines (Saint-Germain-en-Laye - 78);48.9018,2.0505
MFREO d'Escurolles (03);46.1433,3.26433
IFSI Draguignan - rentrée en septembre (83);43.53933,6.45619
CESI Ecole d'ingénieurs - Ecully (69);45.7834,4.7653
CESI Ecole d'Ingénieurs – Strasbourg (Lingolsheim - 67);48.56064,7.69445
Polytech Grenoble (38);45.185,5.75389
Polytech Nantes (44);47.2833,-1.51382
Sup Galilée Paris (Villetaneuse - 93);48.9575,2.34
ENIM Metz (57);49.0926,6.22677
EM Normandie (Le Havre - 76);49.4892,0.10413
Polytech Clermont-Ferrand - IUT d'Allier (Montluçon) - Génie Thermique et Energie (03);46.3283,2.5885
Polytech Marseille - IUT de Marseille - Mesures Physiques (13);43.2327,5.44202
Bachelor IDRAC Business School - Campus de NICE (Mougins - 06);43.6109,7.02216
EIGSI Casablanca (Maroc) (Maroc);33.5575,-7.63076
Lycée Lalande (Bourg-en-Bresse - 01);46.2024,5.22593
Lycée agricole Les Sardieres (Bourg-en-Bresse - 01);46.2138,5.25747
IUT de l'Aisne - Site de Laon (02);49.5596,3.61076
Lycée agricole Digne-Carmejane (Le Chaffaut-Saint-Jurson - 04);44.0322,6.13546
Lycée Les Iscles (Manosque - 04);43.8289,5.79732
Lycée Albert Calmette (Nice - 06);43.7039,7.2714
Lycée agricole DE RETHEL (08);49.5285,4.37429
Lycée Docteur Lacroix (Narbonne - 11);43.1784,3.0013
CFA de l'Aude Antenne de Castelnaudary (11);43.3024,1.93784
Lycée Montmajour (Arles - 13);43.6988,4.63918
