Nom;GPS
CFA des MFR 85 - site de Saint Florent Rives de l'Yon (85);46.5922,-1.31672
Centre de formation d'apprentis Association de formation aux métiers de l'Audio Visuel (Elancourt - 78);48.7938,1.97908
CFA Campus CIFOP CCI Charente (L'Isle-d'Espagnac - 16);45.6691,0.19898
CFA des MFR 85 - site de Château d'Olonne (Les Sables-d'Olonne - 85);46.4948,-1.76217
Lycée des métiers du tertiaire et du social Georges Leygues (Villeneuve-sur-Lot - 47);44.394,0.70924
Lycée Pierre-Paul Riquet (Saint-Orens-de-Gameville - 31);43.5398,1.54871
Lycée des métiers Moliere (Orthez - 64);43.4797,-0.76855
CREPS de Vichy (Bellerive-sur-Allier - 03);46.1328,3.40265
AFTRAL CFA TRANSPORT LOGISTIQUE (Monchy-Saint-Eloi - 60);49.2909,2.46233
Lycée professionnel de Mahina (987);-17.5082,-149.489
Lycée Portes De L'Oisans - GRETA de Grenoble (Vizille - 38);45.0675,5.76967
Lycée professionnel Benoit Charvet (Saint-Etienne - 42);45.4468,4.37769
CFA académique - Lycée Cesar Baggio (Lille - 59);50.6177,3.06739
Lycée Mémona Hintermann-Afféjee (Saint-Denis - 974);-20.91224,55.47906
MFREO Chaumont - CFA FRMFREO (Eyzin-Pinet - 38);45.4994,4.98127
ISEN Lille Cycle préparatoire ADIMAKER - Campus Lille (59);50.6342,3.04871
ESEO Angers Classes préparatoires associées avec le Lycée Mongazon (49);47.4934,-0.5508
ISEN Lille Cycle préparatoire généraliste  (avec le lycée Ozanam) (59);50.6342,3.04871
HEI Lille Cycle préparatoire généraliste  (avec le Lycée La Salle) (59);50.6338,3.04505
Polytech Clermont-Ferrand (Aubière - 63);45.7607,3.10901
Polytech Clermont-Ferrand BIO (Aubière - 63);45.7607,3.10901
Polytech Sorbonne BIO (Paris  5e  Arrondissement - 75);48.8451,2.35695
ISTY Mantes-Vélizy (Mantes-la-Ville - 78);48.98465,1.70169
OF - Centre de formation de la Salle (Charleville-Mézières - 08);49.7715,4.72333
UTC Université de Technologie de Compiègne (60);49.4155,2.81939
ENSIL-ENSCI - Partenaire INSA (Limoges - 87);45.861,1.2954
Lycée Jacques Monod (Saint-Jean-de-Braye - 45);47.9106,1.96882
ICP - Antenne de Reims (51);49.25,4.03333
EPF Troyes (Rosières-près-Troyes - 10);48.2693,4.06375
CFA agricole du Lot (Lacapelle-Marival - 46);44.7278,1.92551
CESI Ecole Supérieure de l'Alternance - Campus d'Aix-En-Provence (13);43.4915,5.32949
CESI Ecole Supérieure de l'Alternance - Campus d'Aix-En-Provence  (13);43.4915,5.32949
CESI Ecole Supérieure de l'Alternance - Campus d'Arras (62);50.2965,2.73356
CESI Ecole Supérieure de l'Alternance - Campus de Bordeaux   (33);44.8651,-0.577
CESI Ecole Supérieure de l'Alternance - Campus de Bordeaux  (33);44.8651,-0.577
CESI Ecole Supérieure de l'Alternance - Campus de Brest  (29);48.4065,-4.52152
CESI Ecole Supérieure de l'Alternance - Campus de Lyon   (Ecully - 69);45.7834,4.7653
CESI Ecole Supérieure de l'Alternance - Campus de Lyon  (Ecully - 69);45.7834,4.7653
CESI Ecole Supérieure de l'Alternance - Campus de Lille  (59);50.6281,3.0711
CESI Ecole Supérieure de l'Alternance - Campus de Toulouse (Labège - 31);43.5483,1.50282
CESI Ecole Supérieure de l'Alternance  - Campus de Toulouse (Labège - 31);43.5483,1.50282
CFPPA de Montravel (Villars - 42);45.47792,4.34475
ANNEXE DE CFA MFREO (Saint-Hippolyte-du-Fort - 30);43.9664,3.86526
CESI Ecole Supérieure de l'Alternance - Campus d’Angoulême (La Couronne - 16);45.6292,0.12106
Polytech Clermont-Ferrand - IUT d'Allier (Montluçon) - Génie Electrique et Informatique Industrielle (03);46.3283,2.5885
Polytech Lille - IUT A de Lille 1 - Génie Electrique et Informatique Industrielle (Villeneuve-d'Ascq - 59);50.6095,3.13711
CESI Ecole Supérieure de l'Alternance - Campus de Strasbourg (Lingolsheim - 67);48.5606,7.69448
CESI Ecole Supérieure de l'Alternance - Campus de Rouen (Saint-Etienne-du-Rouvray - 76);49.3819,1.07422
CESI Ecole Supérieure de l'Alternance - Campus de Montpellier (Mauguio - 34);43.5795,3.94729
CESI Ecole Supérieure de l'Alternance - Campus de Montpellier  (Mauguio - 34);43.5795,3.94729
Lycée professionnel Les Jacobins (Beauvais - 60);49.4306,2.08736
CESI Ecole Supérieure de l'Alternance - Campus de Nanterre  (92);48.9033,2.19298
CESI Ecole Supérieure de l'Alternance - Campus de Nanterre (92);48.9033,2.19298
CESI Ecole Supérieure de l'Alternance - Campus de Nantes (44);47.21667,-1.55
CESI Ecole Supérieure de l'Alternance - Campus de Reims (51);49.2316,4.01244
CESI Ecole Supérieure de l'Alternance  - Campus de Saint Nazaire (44);47.2524,-2.25752
CESI Ecole Supérieure de l'Alternance - Campus de Nancy  (Villers-lès-Nancy - 54);48.6564,6.11732
CESI Ecole Supérieure de l'Alternance - Campus de Nancy (Villers-lès-Nancy - 54);48.6564,6.11732
CFA école supérieure professionnelle AFTEC - Vannes-56 (56);47.66667,-2.75
Polytech Clermont-Ferrand - IUT de Clermont-Ferrand - Génie Industriel et Maintenance (Aubière - 63);45.7508,3.11078
Université de Franche-Comté - Site de Belfort  / Lycée Condorcet de Belfort (90);47.6316,6.85127
Université Grenoble Alpes / Lycée Emmanuel Mounier de Grenoble (Saint-Martin-d'Hères - 38);45.17942,5.73096
Université de Limoges / Lycée Turgot Limoges (87);45.8284,1.24862
Université Jean Monnet / Lycée Fauriel Saint Etienne (42);45.438,4.39398
Université de Perpignan Via Domitia / Lycée Jean Lurçat Perpignan (66);42.6923,2.9089
Université Côte d'Azur / Lycée d'Estienne d'Orves Nice (06);43.69804,7.24318
INSA Euro-Méditerranée (Fès - Maroc);34.0451,-5.06447
Université Paris Nanterre / Lycée Joliot-Curie Nanterre (92);48.8912,2.2079
CY Tech - Cergy (95) / Institut d'Etudes Politiques Saint Germain (78) (95);48.9001,2.06982
ESIEE Paris - Université Gustave Eiffel (Noisy-le-Grand - 93);48.83982,2.58357
Lycée professionnel Emulation Dieppoise (Dieppe - 76);49.61167,1.25083
Centre d'instruction naval Ecole de Maistrance (Brest - 29);48.3696,-4.52555
Lycée la Martinière Monplaisir - CFA GRETA Lyon Métropole (Lyon 8e  Arrondissement - 69);45.7399,4.86873
AFTEC FORMATION (Orléans - 45);47.903,1.90925
CFA agricole du Tarn (Albi - 81);43.9187,2.0983
ESIROI La Réunion (Saint-Pierre - 974);-21.34098,55.49084
Bachelor IDRAC Business School - Campus de Lyon (Lyon 9e  Arrondissement - 69);45.7684,4.80594
Polytech Grenoble - IUT de Grenoble - Chimie (Saint-Martin-d'Hères - 38);45.1986,5.77475
ENSIBS Lorient (56);47.7475,-3.3966
EPITA Rennes (35);48.1036,-1.68885
Lycée Saint Martin (Roubaix - 59);50.6868,3.17115
Euridis Business School LILLE (59);50.6269,3.08011
CFA PROMOTRANS (Toulouse - 31);43.55014,1.40436
ECE Lyon (Lyon 7e  Arrondissement - 69);45.75142,4.84042
CESI Ecole Supérieure de l'Alternance - Campus de Grenoble (Meylan - 38);45.23333,5.78333
CNAM GRAND EST (Saverne - 67);48.73333,7.36667
Centre Régional associé au Conservatoire National des Arts et Métiers Hauts de France - Centre de Lille (59);50.63333,3.06667
CENTRE REGIONAL ASSOC DU CNAM FORT DE FRANCE (972);14.6199,-61.0949
CFA IFTIM METZ (57);49.1193,6.17572
Lycée Sainte-Anne (Verdun - 55);49.1606,5.3813
Centre de formation par apprentissage IRSEC ACADEMY (Fort-de-France - 972);14.61845,-61.04904
CERDIF ANTILLES-GUYANE / ISCA BUSINESS SCHOOL (Fort-de-France - 972);14.61852,-61.04897
CFA - CFAP ( Centre de Formation Apprentissage et Perfectionnement) (Toulouse - 31);43.61995,1.44098
AFTRAL ISTELI (Monchy-Saint-Eloi - 60);49.2888,2.46139
Omega Finance (Paris 12e  Arrondissement - 75);48.8454,2.38771
CFAI 77 - EMERAINVILLE (77);48.8105,2.6146
Euridis Paris (Paris 10e  Arrondissement - 75);48.8875,2.37443
CFA DU JURA (Gevingey - 39);46.6375,5.50707
Aix-Marseille Université - Site d'Aubagne (13);43.28333,5.56667
MAISON FAMILIALE RURALE (La Sauve - 33);44.7735,-0.30315
CFAPAG (Baie-Mahault - 971);16.2686,-61.5138
Lycée professionnel Hotelier Francois Bise (Bonneville - 74);46.0847,6.41002
Lycée professionnel Sainte-Agnes (Vernon - 27);49.0909,1.48019
Lycée Ste Marie (Aix-en-Provence - 13);43.5315,5.44611
CFA de l’Industrie nord Franche-Comté – site de VESOUL (Exincourt - 25);47.501,6.84118
GRETA-CFA Aquitaine (Bordeaux - 33);44.8446,-0.59024
Ecole tech sup privée Isitech Partner Formation Partner Sup' (Lyon 7e  Arrondissement - 69);45.73538,4.84119
Keyce International Academy (Pérols - 34);43.56667,3.95
Sud Formation Conseil (Nîmes - 30);43.8208,4.34458
INSTITUT NATIONAL DES FORMATIONS NOTARIALES DIJON (21);47.3299,5.05205
Ecole Supérieure Privée Aristée (La Valette-du-Var - 83);43.1392,6.0068
Site de Bar le Duc du CFA de la Meuse (55);48.7649,5.18538
Lycée professionnel Germain Sommeiller (Annecy - 74);45.9065,6.12986
LYCEE POLYVALENT DU VAL DE LYS (Estaires - 59);50.6466,2.70485
I.S.C.B. - Institut Supérieur de Commerce et de Bureautique (Tours - 37);47.39112,0.67779
CFA - Ecole supérieure professionnelle AFTEC Laval  (Changé - 53);48.0888,-0.75218
EURIDIS TOULOUSE (31);43.6005,1.45584
ESPL - école supérieure des pays de la loire (Angers - 49);47.47561,-0.60682
Ecole Française Hotesses Tourisme (Paris 14e  Arrondissement - 75);48.8347,2.33429
GRETA de Rouen - site de Mont-Saint-Aignan (76);49.4641,1.07466
Progress com (Paris  3e  Arrondissement - 75);48.86014,2.36675
GRETA de Rouen - Lycée Gustave Flaubert (76);49.4517,1.12403
Sud Management - ESC Agen (47);44.167,0.59544
CFA Ecole supérieure professionnelle AFTEC Caen (Saint-Contest - 14);49.20308,-0.39804
Lycée professionnel Reffye (Tarbes - 65);43.2394,0.06439
Akalis - collège de Paris - Ecole santé et juridique  (Neuilly-sur-Seine - 92);48.88362,2.26313
CFAI AFPI Pays de la Loire / Pôle Formation PDL-UIMM - CFAI CFA de l'industrie de Bretagne (Antenne de Saint Nicolas de Redon) (44);47.6457,-2.06908
Campus AGRONOVA - CFPPA (Précieux - 42);45.5851,4.1541
LA COMPAGNIE DE FORMATION PIGIER Performance (Paris 19e  Arrondissement - 75);48.8962,2.38195
OF-CFA Agence Nationale pour la Formation vers l'Emploi (Paris  9e  Arrondissement - 75);48.87612,2.33536
Lycée Vauban (Givet - 08);50.1333,4.8294
Organisme de formation-Centre de formation d apprentis de ECOLE SUPERIEURE DU LEMAN - THONON LES BAINS (74);46.36667,6.48333
Pigier Performance (Montpellier - 34);43.6128,3.91555
ESICAD (Montpellier - 34);43.6382,3.82953
CFA DELTA - SUP'IPGV (Arles - 13);43.697,4.63683
Lycée professionnel Henri Brulle (Libourne - 33);44.91422,-0.23041
Lycée professionnel Pigier Melun (Dammarie-les-Lys - 77);48.5396,2.65809
GRETA-CFA LOIRE-ATLANTIQUE (Nantes - 44);47.2184,-1.55362
CNAM Grand Est - Epinal (88);48.18333,6.45
CNAM de Polynésie Française (Punaauia - 987);-17.57314,-149.60872
Centre Régional Associé au CNAM (Strasbourg - 67);48.53333,7.71667
Sciences UCampus Paris (Montrouge - 92);48.81667,2.31667
Ecole supérieure privée Pigier Performance (Montigny-le-Bretonneux - 78);48.76667,2.03333
ICCA formation (MAESTRIS) (Reims - 51);49.26341,4.03509
H3 Campus Poissy (78);48.93222,2.04052
Isifa (Levallois-Perret - 92);48.8886,2.28833
Ecole Supérieure Privée Pigier Nice (06);43.71,7.19242
Campus Eductive Toulon Maestris (83);43.1251,5.93515
Etablissement technique privé ISC-Nice (06);43.7,7.25
Ecole supérieure privée NEVEN EDUCATION (Mandelieu-la-Napoule - 06);43.5549,6.95381
Ecole supérieure privée FORMAVAR (La Valette-du-Var - 83);43.13333,5.98333
Ecole du second degré privée hors contrat Silvya Terrade de DUNKERQUE (59);51.0325,2.37213
CFA du Groupe AFTEC - Rennes (35);48.08333,-1.68333
TRAVELLING, École Supérieure du Cinéma et de la Télévision (Mauguio - 34);43.61667,4.01667
ISCT - Institut Supérieur de Commerce de Toulouse (31);43.6,1.43333
Maison Familiale Rurale de Cranves-Sales (74);46.18333,6.3
Organisme de formation-Centre de formation d'apprentis de CFI Formation Clermont-Ferrand (63);45.78333,3.08333
Campus Eductive Euralille - Maestris (59);50.6292,3.05726
Ecole des Métiers du Service du Commerce et de l'Accueil (Bussy-Saint-Georges - 77);48.85,2.7
LA COMPAGNIE DE FORMATION (Pigier) (Lyon 3e  Arrondissement - 69);45.75909,4.86442
CNAM Grand Est - Verdun (55);49.1587,5.38654
EPSECO MIX - Talis Business School - Campus de Bergerac (24);44.8538,0.48339
IFAG Bordeaux École supérieure de management (33);44.8652,-0.56035
ORGANISME DE FORMATION - CENTRE DE FORMATION D APPRENTIS Groupe Alternance Toulouse (31);43.60976,1.39671
Ecole Technique Privee Compagnie De Formation-Pigier (Nancy - 54);48.6973,6.17373
Ecole technique supérieure privée Camas Academy (Lyon 8e  Arrondissement - 69);45.7465,4.86796
Institut supérieur de l'audiovisuel (Paris 10e  Arrondissement - 75);48.8397,2.30244
CAMPUS EDUCTIVE AIX-EN-PROVENCE MAESTRIS (13);43.5236,5.43274
ESIMA Lyon (Lyon 7e  Arrondissement - 69);45.75268,4.84764
ALTERNANCE AZUR - Gap (05);44.56667,6.08333
Alpha primo (Roanne - 42);46.0,4.06667
Groupe Alternance Nantes (Carquefou - 44);47.3,-1.5
Alternance Anjou (Angers - 49);47.46667,-0.63333
IFCP Institut de Formation Cergy-Pontoise (Saint-Ouen-l'Aumône - 95);49.0463,2.13557
Ascencia - Paris-la-Défense (Puteaux - 92);48.86667,2.23333
Organisme formation - Centre de formation d'Apprentis Aero Run Training Sainte Marie (974);-20.8941,55.5308
PIGIER PERFORMANCE (Saint-Martin-d'Hères - 38);45.16667,5.76667
Ecole.Technique.Privée (ETP) - PIGIER (Nantes - 44);47.2447,-1.61942
OF-CFA Centre de formation d'esthétique et de parfumerie (Paris  8e  Arrondissement - 75);48.8733,2.31178
Lycée Acajou 2 (Le Lamentin - 972);14.6294,-61.0154
Organisme de formation-Centre de formation d'apprentis EFASUP VILLEURBANNE (69);45.7704,4.88059
Purple Campus Perpignan (ex-CCI Sud Formation) (66);42.6746,2.85036
SAS Sud Campus (Sète - 34);43.4,3.68333
Ecole technologique privée ORT Maurice Grynfogel (Colomiers - 31);43.6027,1.33265
IPAM (Institut Privé de Paramédical) - ECOSUP Santé (Tourcoing - 59);50.71667,3.15
OF Turenne Compétences - centre d'apprentissage (Charleville-Mézières - 08);49.7675,4.72279
Organisme de formation-Centre de formation d'apprentis CFEP LYON (Lyon 7e  Arrondissement - 69);45.7282,4.83806
CFA de l'Industrie des Ardennes (Charleville-Mézières - 08);49.7714,4.70963
Ecole technique privée Pigier Performance (Bègles - 33);44.8,-0.53333
IFAG - Toulouse (31);43.6108,1.41379
Sciences Po - campus du Havre, de Menton ou de Reims - Hong Kong University (Le Havre - 76);22.28326,114.13704
IUT Lyon1 Site de Bourg-en-Bresse (01);46.215,5.24136
Lycée Pierre Méchain (Laon - 02);49.559,3.63207
Lycée agricole et viticole de Crézancy (02);49.0492,3.50951
Lycée agricole La Thierache-Fontaine les Vervins (02);49.8337,3.88519
PROMEO CFAI 8002 - Antenne de Soissons (Billy-sur-Aisne - 02);49.3727,3.34628
Lycée Saint Joseph (Château-Thierry - 02);49.042,3.39501
Lycée Saint Remy (Soissons - 02);49.3762,3.32313
I.U.T. d'Allier - site de Montluçon (03);46.3283,2.5885
LEAP Claude Mercier (Le Mayet-de-Montagne - 03);46.075,3.66719
Lycée Anna Rodier (Moulins - 03);46.5666,3.33573
Lycée PIERRE-GILLES DE GENNES (Digne-les-Bains - 04);44.0734,6.18085
Lycée Dominique Villars (Gap - 05);44.5613,6.07589
Lycée Fenelon (Grasse - 06);43.6566,6.92369
I.U.T de Nice - Antenne de Menton (06);43.7776,7.501
Lycée polyvalent Pyrène (Pamiers - 09);43.1144,1.6086
MFREO de St Sernin / Rance (Saint-Sernin-sur-Rance - 12);43.8808,2.61244
Lycée St Joseph De La Madeleine (Marseille  4e  Arrondissement - 13);43.3019,5.39432
Lycée Chimie et Biologie (Marseille 11e  Arrondissement - 13);43.2868,5.46644
Lycée Jeanne D Arc (Arles - 13);43.6743,4.64216
Lycée Jean Monnet (Vitrolles - 13);43.4246,5.27254
Lycée agricole Le Robillard (Saint-Pierre-en-Auge - 14);48.9883,-0.00522
IUT GRAND OUEST NORMANDIE - Pôle de Caen - Site de Lisieux (14);49.1484,0.22887
Lycée Guez De Balzac (Angoulême - 16);45.651,0.14676
Lycée Emile Roux (Confolens - 16);46.0085,0.67207
Lycée Jean Dautet (La Rochelle - 17);46.1648,-1.15397
Lycée Cordouan (Royan - 17);45.6204,-1.00326
Lycée Bellevue (Saintes - 17);45.737,-0.64344
Lycée polyvalent Du Pays D'Aunis (Surgères - 17);46.1085,-0.74513
Lycée CFA de l'Alimentation - ENILIA ENSMIC (Surgères - 17);46.107,-0.76986
Lycée Georges Cabanis (Brive-la-Gaillarde - 19);45.1595,1.52387
Lycée agricole HENRI QUEUILLE (Neuvic - 19);45.3781,2.27338
LEGTA Edgard PISANI de Tulle-Naves (19);45.323,1.76919
CFA de la CMA - Ploufragan (22);48.4888,-2.79437
Lycée Pommerit Jaudy (La Roche-Jaudy - 22);48.7422,-3.24498
Lycée Des Metiers Du Batiment (Felletin - 23);45.8893,2.17728
Lycée agricole Jeanne d'Arc (Pontarlier - 25);46.90616,6.33413
Lycée agricole Edouard de Chambray (Mesnils-sur-Iton - 27);48.8391,1.00053
Lycée André Malraux (Gaillon - 27);49.1668,1.34616
Lycée Marc Bloch (Val-de-Reuil - 27);49.2688,1.20228
Lycée Emile Zola (Châteaudun - 28);48.0726,1.33339
Lycée agricole de Chartres (Sours - 28);48.406,1.55654
Lycée Rene Laennec (Pont-l'Abbé - 29);47.8612,-4.23354
Lycée polyvalent Dupuy de Lôme (Brest - 29);48.3908,-4.5092
Lycée St Louis (Châteaulin - 29);48.1974,-4.08568
Lycée Ste Therese (Quimper - 29);47.9815,-4.09523
Lycée La Croix Rouge (Brest - 29);48.4099,-4.48779
Lycée Estran Charles De Foucauld (Brest - 29);48.403,-4.45877
Lycée du Leon (Landivisiau - 29);48.508,-4.06026
Lycée St Vincent De Paul (Nîmes - 30);43.8349,4.36192
Purple Campus Marguerittes (ex-CCI Sud Formation) (30);43.869,4.44488
Lycée Marcelin Berthelot (Toulouse - 31);43.5882,1.4426
Lycée professionnel Du Mirail - CFA Académique Midi-Pyrénées (Toulouse - 31);43.5856,1.39826
Lycée Montaigne (Bordeaux - 33);44.8335,-0.57306
CPBx (ENSCBP département Chimie, Génie Physique) (Talence - 33);44.808,-0.59514
Lycée agricole de Libourne Montagne (33);44.9537,-0.16595
CFA CCI Ille-et-Vilaine site de Saint Jouan des Guérets (35);48.6033,-1.97763
CFAI de Bretagne - antenne CCI de Fougères (Javené - 35);48.332,-1.1997
Lycée Louise Michel - GRETA de Grenoble (38);45.1683,5.70642
Lycée Jeanne D'Arc (Champagnole - 39);46.7467,5.90633
Lycée Rosa Parks (Thionville - 57);49.36505,6.14848
CFA académique - Lycée De L'Europe (Dunkerque - 59);51.0204,2.35485
Lycée Louis Pasteur (Lille - 59);50.6412,3.06837
Lycée Antoine Watteau (Valenciennes - 59);50.3583,3.53179
Lycée Jean Prouve (Lille - 59);50.6507,2.99656
Lycée du PAYS DE CONDE (Condé-sur-l'Escaut - 59);50.4608,3.58363
Institution Sevigne (Compiègne - 60);49.4161,2.82968
Lycée St Joseph Du Moncel (Pont-Sainte-Maxence - 60);49.3003,2.60631
Lycée CONDORCET (Méru - 60);49.2376,2.14318
Lycée Leclerc Navarre (Alençon - 61);48.4169,0.08947
Lycée Sophie Berthelot (Calais - 62);50.9474,1.8424
Lycée Albert Chatelet (Saint-Pol-sur-Ternoise - 62);50.3877,2.34936
Lycée agro-environnemental d'Arras (Tilloy-lès-Mofflaines - 62);50.2741,2.83746
Université d'Artois - Site de Béthune (62);50.5296,2.64004
Université du littoral - Site de Saint-Omer (Longuenesse - 62);50.73464,2.26068
Lycée Murat (Issoire - 63);45.5503,3.24829
Lycée René Cassin Bayonne-Biarritz (64);43.481,-1.48208
Lycée Professionnel Agricole DE MUGRON (40);43.7511,-0.74876
CFA Régional Saint Louis- Lycée Industriel et Commercial (Tourcoing - 59);50.7207,3.14982
Lycée professionnel des métiers de la maintenance Paul-Emile Victor (Obernai - 67);48.4632,7.49131
Lycée PHILIPPINE DUCHESNE ITEC BOISFLEURY - CFA AKTEAP (Corenc - 38);45.2124,5.75817
CFA Ecole Technique Supérieure de Chimie de l'Ouest (Angers - 49);47.4625,-0.5453
CFA DE L'ENSEIGNEMENT CATHOLIQUE DE SARTHE - UFA Lycée Saint Joseph La Salle (Pruillé-le-Chétif - 72);47.9831,0.13984
Lycée Polyvalent Joubert - E. Maillard (Ancenis-Saint-Géréon - 44);47.3754,-1.18236
Lycée polyvalent privé Bourg-Chevreau (Segré-en-Anjou Bleu - 49);47.6811,-0.87156
Lycée professionnel Thomas Pesquet (Coutances - 50);49.0428,-1.43698
IFSI CH de Gonesse - rentrée en septembre (95);48.9934,2.44845
IFSI CH René Dubos Pontoise - rentrée en septembre (95);49.05197,2.1002
IFSI CH d'Arles - rentrée en septembre (13);43.6818,4.62525
IFSI Capelette - rentrée en septembre (Marseille 10e  Arrondissement - 13);43.2831,5.41143
IFSI CHU ANGERS - rentrée en septembre (49);47.4833,-0.55769
IFSI Bicetre (AP-HP) - rentrée en septembre (Le Kremlin-Bicêtre - 94);48.813,2.35658
Institut de Formation en Soins Infirmiers - LAON - rentrée en septembre (02);49.56451,3.61348
Institut de Formation en Soins Infirmiers - BEAUVAIS - rentrée en septembre (60);49.44987,2.07046
Institut de Formation en Soins Infirmiers – EPSM de la Somme - rentrée en septembre (Amiens - 80);49.87033,2.27586
IFSI CH Beaune - rentrée en septembre (21);47.03316,4.83486
IFSI CH Paray Le Monial - rentrée en septembre (71);46.4583,4.11044
IFSI CH Mémorial Feu Saint-Lo - rentrée en septembre (50);49.111,-1.09257
IFSI CH Vichy - rentrée en septembre (03);46.12279,3.4333
IFSI CHU Besançon - rentrée en septembre (25);47.23331,5.96246
INST. FORM. SOINS INFIRMIERS CENTRE HOSPITALIER PONTARLIER - rentrée en septembre (25);46.9034,6.34571
IFSI Croix Rouge Française Vesoul - rentrée en septembre (70);47.6275,6.1603
IFSI Centre Hospitalier Alpes Leman - rentrée en septembre (Ambilly - 74);46.1981,6.23001
IFSI du Centre Hôspitalier de Cambrai - rentrée en septembre (59);50.174,3.24498
IFSI CH St-Omer - rentrée en septembre (Saint-Omer - 62);50.7025,2.2579
IFSI Croix Rouge Française Lens - rentrée en septembre (62);50.4428,2.8273
IFSI CHU de Limoges - rentrée en septembre (87);45.8288,1.25244
IFSI du Bugey - rentrée en septembre (Plateau d'Hauteville - 01);45.98406,5.6015
IFSI Croix Rouge Française Nîmes - rentrée en septembre (30);43.8114,4.37187
IFSI CH Béziers - rentrée en septembre (34);43.3525,3.23861
IFSI Sarrebourg - rentrée en septembre (57);48.72928,7.05186
IFSI Virginie Olivier CH Sainte Anne - rentrée en septembre (Paris 14e  Arrondissement - 75);48.8297,2.33989
IFSI CH Saintonge - rentrée en septembre (Saintes - 17);45.747,-0.65182
IFSI de Saverne - rentrée en septembre (67);48.74675,7.34727
IFSI Selestat - rentrée en septembre (67);48.2576,7.41846
IFSI Brumath - rentrée en septembre (67);48.6697,7.72545
IFSI CH Int Val Ariège - rentrée en septembre (Pamiers - 09);43.1127,1.60858
IFSI CH Montauban - rentrée en septembre (82);44.0221,1.35179
IFSI CH Blois - rentrée en septembre (41);47.60275,1.34415
IFSI Pitié Salpetrière (AP-HP) - rentrée en septembre (Paris 13e  Arrondissement - 75);48.8408,2.36276
IFSI du CHI de Villeneuve-St-Georges - rentrée en septembre (Villeneuve-Saint-Georges - 94);48.72205,2.4526
MFR ST-EGREVE (Saint-Egrève - 38);45.2331,5.68154
Institut Régional et Européen des métiers de l'Intervention Sociale Rhône-Alpes - IREIS (Annecy - 74);45.9132,6.11382
IREIS Annecy (74);45.9132,6.11382
AFERTES (Arras - 62);50.2871,2.77409
ADAMSSE CFA - ARIFTS Pays de la Loire Rezé (44);47.1888,-1.56632
ERASME (Toulouse - 31);43.55951,1.42378
ANNEXE DE CFA LONS LE SAUNIER MANCY (39);46.6646,5.54672
Centre de Formation d'Apprentis Agricole (Melle - 79);46.2272,-0.15152
ETSUP (Paris 15e  Arrondissement - 75);48.84273,2.32277
INSTITUT DE FORMATION SOCIALE DES YVELINES (Buc - 78);48.7738,2.12636
IRFASE (Evry-Courcouronnes - 91);48.62816,2.43093
CENTRE DE FORMATION L'HORIZON (Malakoff - 92);48.8188,2.29716
Centre Forestier de la région Provence-Alpes-Côte d'Azur (La Bastide-des-Jourdans - 84);43.7707,5.65504
Lycée professionnel Ferdinand Buisson (Ermont - 95);48.9783,2.27259
ICD International Business School - Campus de Paris (Paris 10e  Arrondissement - 75);48.8799,2.36576
CFA CHAMBRE DES METIERS LES ARCS (83);43.45535,6.48235
IFSI Institut Gernez Rieux CHru de Lille - rentrée en septembre (59);50.6124,3.02891
IFSI CH de Perigueux - rentrée en septembre (24);45.19421,0.73
IFSI CH Mont de Marsan - rentrée en septembre (40);43.9013,-0.50012
IFSI CH Intercomm Marmande Tonneins - rentrée en septembre (47);44.50258,0.16564
CFA Agricampus - Laval (53);48.0496,-0.79497
CFA régional de la Cité technique LPP Saint André (Marseille 16e  Arrondissement - 13);43.3605,5.34214
CFA Agrilia - site MFR Venansault (Montreuil-sur-Loir - 49);47.5783,-0.38246
ISTEC - Ecole Supérieure de Commerce et de Marketing (Paris 10e  Arrondissement - 75);48.8758,2.36479
ISIT - Institut de Management et de Communication Interculturels (Paris  6e  Arrondissement - 75);48.8468,2.33065
LP Jean Moulin (Thouars - 79);46.9936,-0.21327
Lycée Francois Magendie (Bordeaux - 33);44.827,-0.58502
Lycée Du Matin Le Mirail (Bordeaux - 33);44.8335,-0.57096
ICL - ISTC (Lille - 59);50.63143,3.04581
CFA des Vosges (Mirecourt - 88);48.2978,6.12698
Lycée polyvalent Saint Jacques de Compostelle (Le Puy-en-Velay - 43);45.0453,3.88623
Université de Montpellier, Antenne de Perpignan (66);42.6865,2.88391
Lycée professionnel Jean Rostand (Angoulême - 16);45.6535,0.17808
EPL AGRO de la Meuse - Site de Verdun (55);49.1452,5.39513
Lycée St J-B De La Salle (Reims - 51);49.2583,4.0317
IFSI GH Nord Essonne - rentrée en septembre (Longjumeau - 91);48.69365,2.28763
Institut Catholique de Lyon - ESTRI (69);45.7514,4.82694
Lycée professionnel Saint Joseph (Bourg-en-Bresse - 01);46.2014,5.22607
Lycée agricole Kernilien (Plouisy - 22);48.5617,-3.19668
ASKORIA - Site de Saint-Brieuc (22);48.5224,-2.78505
IRTS Champagne Ardenne (Reims - 51);49.2309,4.00284
IRTS POITOU CHARENTES (Poitiers - 86);46.57793,0.33023
Ecole supérieure européenne de l'intervention sociale (Strasbourg - 67);48.5767,7.75292
Lycée La Martinière-Diderot - CFA des métiers de l'énergie EDF (Lyon 1er Arrondissement - 69);45.7679,4.82981
IFSI CH Paul Guiraud - rentrée en septembre (Villejuif - 94);48.7888,2.36757
Lycée professionnel VIRGINIA HENDERSON (Arnouville - 95);48.9854,2.40725
Institut de Formation en Soins Infirmiers - CHATEAU-THIERRY - rentrée en septembre (02);49.04518,3.3924
Lycée professionnel de L'Yser (Wormhout - 59);50.8832,2.46302
GRETA-CFA 49 - Lycée Chevrollier (Angers - 49);47.4549,-0.5609
Lycée Vallee De Chevreuse (Gif-sur-Yvette - 91);48.7003,2.09856
Lycée professionnel Le Corbusier (Cormeilles-en-Parisis - 95);48.9789,2.19993
CESI Ecole d'ingénieurs - Campus de Strasbourg  (Lingolsheim - 67);48.56064,7.69445
CESI Ecole d'ingénieurs -  Campus de Saint Nazaire (44);47.2524,-2.25752
