Nom;GPS
Facultés libres de l'ouest - UCO - Bretagne Nord (Guingamp - 22);48.5612,-3.1642
Facultés libres de l'ouest UCO - Angers (49);47.4631,-0.54678
Lycée polyvalent Jean Moulin (Béziers - 34);43.3432,3.23372
Lycée polyvalent privé La Salle (Lille - 59);50.6291,3.03928
CFA DU LYCEE STANISLAS (Wissembourg - 67);49.0352,7.96057
CARREL Centre de formation (Lyon 6e  Arrondissement - 69);45.7662,4.84964
Université Grenoble Alpes (38);45.1922,5.77368
CFA de l'industrie Rouen/Dieppe (Le Mesnil-Esnard - 76);49.4142,1.14569
IFA - CFA DE LA CCI ALSACE (Strasbourg - 67);48.5551,7.74507
IFA - CFA DE LA CCI ALSACE (Mulhouse - 68);47.727,7.30809
Lycée Roger Verlomme (Paris 15e  Arrondissement - 75);48.848,2.29319
Lycée Guy De Maupassant (Fécamp - 76);49.7465,0.38721
Lycée Pierre Corneille (Rouen - 76);49.4457,1.10117
CY TECH - Université de Cergy-Pontoise (95);49.0388,2.07414
Université de Cergy-Pontoise - CY SUP (95);49.0388,2.07414
Lycée professionnel L Abbaye (Beaugency - 45);47.777,1.63422
Lycée Marie De Champagne (Troyes - 10);48.3059,4.06343
Lycée Raymond Naves (Toulouse - 31);43.638,1.46135
Lycée Antoine Bourdelle (Montauban - 82);44.0131,1.3699
Lycée Charles Carnus (Rodez - 12);44.3556,2.55569
Lycée professionnel agricole du Robert (Le Robert - 972);14.6769,-60.9453
Lycée professionnel Desaix (Saint-Eloy-les-Mines - 63);46.1613,2.81925
lycée E.P.I.D. (Dunkerque - 59);51.027,2.37163
Lycée professionnel Rontaunay (Saint-Denis - 974);-20.8877,55.47
Lycée Saint-Paul (Lens - 62);50.436,2.82236
Lycée professionnel Sainte-Marie (Bagnols-sur-Cèze - 30);44.1612,4.62384
Lycée Bonaparte (Autun - 71);46.9382,4.2943
Lycée professionnel Raoul Mortier (Montmorillon - 86);46.4281,0.86123
Lycée professionnel Les Savarières (Saint-Sébastien-sur-Loire - 44);47.2107,-1.48975
Lycée Frederic Et Irene Joliot Curie (Hirson - 02);49.9298,4.08236
Lycée Du Hainaut (Valenciennes - 59);50.3583,3.51076
Université de La Rochelle (17);46.1476,-1.15511
Université Jean Moulin Lyon 3 (Lyon 8e  Arrondissement - 69);45.74813,4.86025
Université Toulouse 2 Jean Jaurès (31);43.5784,1.40266
CFAI SUD FRANCHE-COMTE Dole et Gevingey (39);47.0988,5.49593
Université Angers-Campus de Cholet (49);47.0486,-0.86659
BATIMENT CFA EVREUX (27);49.002,1.13422
Université de Bordeaux - Bordeaux Métropole (Talence - 33);44.8081,-0.59556
Lycée Amiral Pierre Bouvet (Saint-Benoît - 974);-21.0397,55.7156
Lycée Raymond Queneau (Yvetot - 76);49.6135,0.769
Lycée du Forez (Feurs - 42);45.7514,4.22848
Université Lumière-Lyon 2 (69);45.7508,4.83627
Lycée Jay De Beaufort (Périgueux - 24);45.1817,0.711
Université Toulouse 3 Paul Sabatier (31);43.5608,1.46936
Lycée professionnel Tristan Corbiere (Morlaix - 29);48.5776,-3.82823
Sorbonne Université – Sciences et Ingénierie (Paris  5e  Arrondissement - 75);48.8466,2.35455
Université de Perpignan Via Domitia (66);42.6846,2.89905
Avignon Université (84);43.9499,4.81762
Lycée Porto Vecchio (20);41.5995,9.27139
L.P.A. de Mirande (32);43.5161,0.40335
Université de Nantes (44);47.2447,-1.55109
Université Bordeaux Montaigne (Pessac - 33);44.7966,-0.61747
Université de Limoges - Antenne de Brive (Brive-la-Gaillarde - 19);45.1547,1.5092
CFAI SUD FRANCHE-COMTE Besançon (25);47.2537,5.99745
Lycée Les Andaines (La Ferté Macé - 61);48.5861,-0.35896
Brest Business School (29);48.4061,-4.52165
Université Savoie Mont Blanc - Chambéry (Jacob-Bellecombette - 73);45.558,5.91097
IUT C - Roubaix - Université de Lille (59);50.69668,3.16553
Lycée Professionnel St Genes La Salle (Bordeaux - 33);44.8248,-0.58047
Université de Rennes 2 (35);48.12162,-1.70445
Lycée CASSINI (Clermont - 60);49.3838,2.40553
Lycée professionnel Paul Louis Cyfflé (Nancy - 54);48.6869,6.18204
I.U.T de Bordeaux - Site de Périgueux (24);45.1965,0.71765
CFA Campus du Lac - Campus de Bordeaux. (33);44.8763,-0.57437
Lycée de Mauriac (15);45.2121,2.33988
Antenne d'Albi du CFA du Tarn (81);43.9187,2.0983
Lycée La Fayette (Clermont-Ferrand - 63);45.7626,3.13152
Maison Familiale et Rurale du Clunisois (Mazille - 71);46.3964,4.61071
Lycée Paul Langevin (Beauvais - 60);49.415,2.10628
CFA de l'industrie de la Marne (Reims - 51);49.2388,4.06294
Université d'Orléans (45);47.8502,1.93351
CFA 79 - Bressuire (79);46.841,-0.51273
PROMEO CFAI 8002 - Antenne de Soissons (02);49.3727,3.34628
Lycée des Métiers le Corbusier de Soissons (02);49.3645,3.31632
Lycée Sarda Garriga (Saint-André - 974);-20.9652,55.6544
Lycée Marie Curie (Nogent-sur-Oise - 60);49.2663,2.463
Lycée ORT (Lyon 8e  Arrondissement - 69);45.738,4.86799
CFA de la CCI de la Mayenne - Ecole Supérieure de Commerce et Management de la Mayenne (Laval - 53);48.0876,-0.7548
LGT Réaumur (Laval - 53);48.0683,-0.75872
Lycée Gaston Crampe (Aire-sur-l'Adour - 40);43.6916,-0.27834
Université Savoie Mont Blanc - Bourget-du-Lac (Le Bourget-du-Lac - 73);45.6415,5.87052
CFA de l'industrie de l'Aube (Rosières-près-Troyes - 10);48.268,4.07664
CFI, Ecole connectée au futur de l'industrie, site de Montigny (Montigny-le-Bretonneux - 78);48.7743,2.0167
Maison familiale rurale de Mouilleron (Mouilleron-Saint-Germain - 85);46.6749,-0.84812
Lycée Pierre Mendes France (Vic-en-Bigorre - 65);43.389,0.05577
Lycée Marie Curie (Tarbes - 65);43.2238,0.0768
Université Angers (49);47.47857,-0.55009
CFA AGRIC. CFAAD DU LOIRET (Bellegarde - 45);47.9878,2.43902
CFA Robert SCHUMAN (Metz - 57);49.1105,6.20728
Lycée polyvalent Charles de Gaulle (Muret - 31);43.4995,1.30972
Lycée Hemingway - De La Camargue (Nîmes - 30);43.8249,4.35335
ISVT (Vals-près-le-Puy - 43);45.0332,3.87943
Lycée Sainte Marguerite (Chambray-lès-Tours - 37);47.3456,0.72164
Lycée Jules Verne (Mondeville - 14);49.168,-0.32733
BTP CFA DE LOIR ET CHER (Blois - 41);47.6095,1.32048
Lycée Emmanuel d'Alzon (Nîmes - 30);43.8344,4.37175
Institut Catholique de Lyon (69);45.7514,4.82694
IMEA Vesoul (70);47.6405,6.15057
Lycée Le Likès (Quimper - 29);48.0004,-4.10193
CFA DU BATIMENT ET DES TRAVAUX PUBLICS (Clermont-Ferrand - 63);45.7685,3.11262
Lycée professionnel Jean Albert Gregoire (Soyaux - 16);45.6299,0.2178
Lycée Nicéphore Niepce (Chalon-sur-Saône - 71);46.7874,4.83813
CFA du bâtiment et travaux publics Georges Boché (Massiac - 15);45.2612,3.1775
Lycée La Martinière Duchère (Lyon 9e  Arrondissement - 69);45.7855,4.79556
Lycée Blaise Pascal (Colmar - 68);48.0692,7.33684
Lycée Jean De Prades (Castelsarrasin - 82);44.0329,1.12267
Lycée Ferdinand Buisson (Voiron - 38);45.3616,5.60061
Lycée Saint-Louis (Crest - 26);44.7246,5.0265
Lycée Francois Arago (Reims - 51);49.2292,4.00632
Lycée professionnel Des Metiers Du Batiment (Felletin - 23);45.8893,2.17728
Lycée St Laurent La Paix Notre Dame (Lagny-sur-Marne - 77);48.8733,2.70865
Lycée Pierre_Marie THEAS (Montauban - 82);44.0005,1.36097
Lycée professionnel Nicolas Louis Vauquelin (Paris 13e  Arrondissement - 75);48.8221,2.37561
Lycée Laurent de Lavoisier (Mulhouse - 68);47.7547,7.32587
BTP CFA Charente-Maritime (Saintes - 17);45.7422,-0.66542
CFA JEAN ZAY (Jarny - 54);49.1579,5.87721
CFA La Germinière (Rouillon - 72);48.0118,0.12405
Lycée hôtelier RENOUVEAU (Saint-Genest-Lerpt - 42);45.4525,4.3304
Lycée Jean Moulin (Roubaix - 59);50.6851,3.17247
Lycée de Bois D'Olive (Saint-Pierre - 974);-21.2983,55.4575
Lycée professionnel de St Henri (Marseille 16e  Arrondissement - 13);43.3658,5.3396
Lycée des Iles Sous Le Vent (Uturoa - 987);-16.8164,-151.455
Lycée Emile Zola (Aix-en-Provence - 13);43.5112,5.44468
Université de Mulhouse - Site de Colmar - Faculté de marketing et d'agrosciences (68);48.0777,7.36936
Université de Lille (59);50.61073,3.14268
Lycée Victor Hugo (Marseille  3e  Arrondissement - 13);43.3047,5.37969
Lycée Jean Zay (Thiers - 63);45.8626,3.5295
Lycée professionnel hôtelier Notre Dame (Saint-Méen-le-Grand - 35);48.1904,-2.18737
CFA Santé et Sciences de la Vie (Bétheny - 51);49.2724,4.04477
CFA TRAVAUX PUBLICS PACA (Mallemort - 13);43.7316,5.18054
Université de Caen Normandie (14);49.1889,-0.36388
CFA Groupe ESA (Angers - 49);47.4592,-0.54405
Université Le Havre Normandie (76);49.4959,0.12911
Ecole supérieure d'art et de design TALM-Angers (49);47.4667,-0.54842
Lycée professionnel De L Estuaire (Blaye - 33);45.1268,-0.66294
Lycée polyvalent des métiers de l'aéronautique Jean Taris (Peyrehorade - 40);43.549,-1.09086
Université de Rennes 1 (35);48.1198,-1.64001
ANTENNE DE CFA ANNEXE DE ST ANDRE (Saint-André - 974);-20.9636,55.6579
Sorbonne Université – Lettres, Arts, Langues, Sciences Humaines et Sociales (Paris  5e  Arrondissement - 75);48.8483,2.34281
Lycée St Joseph La Joliverie (Saint-Sébastien-sur-Loire - 44);47.1897,-1.51701
CFA INDUSTRIE (Bruges - 33);44.8888,-0.61442
Institut de Formation de Manipulateurs d’Electroradiologie Médicale (Clermont-Ferrand - 63);45.7613,3.09133
Ecole Supérieure d'Art et Design Le Havre-Rouen (ESADHaR) site de Rouen (76);49.4482,1.1371
Lycée Militaire de Saint-Cyr (Saint-Cyr-l'Ecole - 78);48.7998,2.06806
Institut Supérieur de l'Enseignement Privé de Polynésie (Papeete - 987);-17.5516,-149.558
CFA CF Métiers du Bâtiment et des Travaux publics (Trappes - 78);48.7663,1.99961
Lycée polyvalent Nicolas Appert (Orvault - 44);47.2509,-1.6068
Lycée Hotellerie Et Tourisme (Guyancourt - 78);48.7629,2.07532
Centre de formation d'apprentis Gescia CCI Paris Ile-de-France (Enghien-les-Bains - 95);48.9693,2.30937
Université de Bourgogne - site de Dijon (21);47.3135,5.06427
Université des Antilles - Pôle Guadeloupe (Pointe-à-Pitre - 971);16.2243,-61.5289
Université des Antilles - Pôle Guadeloupe (Saint-Claude) (971);16.0264,-61.6953
Lycée professionnel Jean Nicoli (Bastia - 20);42.6985,9.45098
CIPECMA et Campus CIPECMA CFAI PC (Châtelaillon-Plage - 17);46.0814,-1.08733
CFA FORMAVENIR (Thyez - 74);46.0768,6.54091
Université de Brest - Site de Quimper (29);47.9723,-4.09372
CFA MFR de Basse Normandie CFA AGRIC (Maltot - 14);49.1311,-0.41092
Lycée Vauban (Brest - 29);48.4075,-4.48218
Lycée Roland Garros (Le Tampon - 974);-21.2734,55.5221
Lycée Stanislas (Cannes - 06);43.5526,7.00834
Formapole (Châtellerault - 86);46.8329,0.5349
L.E.G.T.A. Beaulieu-Lavacant (Auch - 32);43.6213,0.5779
Université du Mans (Le Mans - 72);48.0164,0.16211
Lycée Andre Argouges (Grenoble - 38);45.1767,5.74588
IPAC VILLE-LA-GRAND (74);46.2091,6.28211
CFAI Limousin - site de Tulle (19);45.2606,1.7513
CFAI Turgot (Limoges - 87);45.8284,1.24862
Lycée Joliot-Curie (Nanterre - 92);48.8903,2.20655
Lycée PIERRE MENDES FRANCE (Péronne - 80);49.9351,2.94059
Lycée professionnel Louis BLERIOT (Cambrai - 59);50.1628,3.25386
Lycée Gaston Berger (Lille - 59);50.6134,3.0784
Lycée professionnel Montaigne (Amiens - 80);49.9106,2.31961
Université de Strasbourg (67);48.5783,7.76272
Lycée professionnel des Métiers Châteauneuf (Argenton-sur-Creuse - 36);46.5826,1.5155
CDFA agricole de la Corrèze (Voutezac - 19);45.2763,1.42068
Lycée Louis Rascol (Albi - 81);43.9318,2.1543
Lycée Emile Littré (Avranches - 50);48.6769,-1.35867
CFA METIERS DE LA MECANIQUE AFORP (Issy-les-Moulineaux - 92);48.8187,2.27611
Lycée professionnel Le Dolmen (Poitiers - 86);46.5783,0.36675
Lycée Claude De France (Romorantin-Lanthenay - 41);47.3687,1.73965
CFA ORLEANS METROPOLE (45);47.9174,1.93076
AFORP Mantes-La-Ville (78);48.982,1.70955
Lycée professionnel Du Blavet (Pontivy - 56);48.0581,-2.95825
Lycée professionnel Leonard De Vinci (Montpellier - 34);43.6264,3.82385
Lycée Raoul Dautry (Limoges - 87);45.8395,1.27931
Université des Antilles - Pôle Martinique (Schoelcher - 972);14.6479,-61.0995
Lycée Marcel Dassault (Rochefort - 17);45.9474,-0.95889
Lycée professionnel La Providence (Dieuze - 57);48.8118,6.72036
Lycée Marcellin Berthelot (Questembert - 56);47.6634,-2.464
CENTRE DE FORMATION D'APPRENTIS AFORP - FORMATION (Tremblay-en-France - 93);48.9764,2.5033
Lycée agricole Besancon - Lycée Granvelle (Dannemarie-sur-Crète - 25);47.2014,5.87382
Lycée Professionnel Jehan Duperier (Saint-Médard-en-Jalles - 33);44.8961,-0.70544
Lycée professionnel Lino Ventura (Ozoir-la-Ferrière - 77);48.759,2.6923
Lycée professionnel Jean Prouve (Nancy - 54);48.6754,6.19629
Lycée Irene et Frederic Joliot Curie (Sète - 34);43.3964,3.66534
Lycée Henri Wallon (Valenciennes - 59);50.3641,3.52067
Lycée Hotellerie Et Tourisme d'Occitanie (Toulouse - 31);43.5971,1.40494
LYCEE POLYVALENT DE MAMOUDZOU NORD (976);-12.7668,45.225
Lycée professionnel Joseph Marie Jacquard (Lavelanet - 09);42.9232,1.84104
Lycée professionnel Jouffroy D'Abbans (Baume-les-Dames - 25);47.3496,6.35226
Lycée Joliot Curie (Dammarie-les-Lys - 77);48.5191,2.64791
Lycée Jeanne d'Arc (Rennes - 35);48.1194,-1.65369
Lycée Général et Technologique Albert Londres (Cusset - 03);46.1317,3.44232
Lycée professionnel Jean-Baptiste Colbert (Le Petit-Quevilly - 76);49.4211,1.05206
Facultés libres de l'ouest - UCO - Nantes (Rezé - 44);47.1763,-1.53884
Lycée professionnel Condorcet (Saint-Quentin - 02);49.8617,3.2938
CFA de l'Ain - AFPMA APPRENTISSAGE (Péronnas - 01);46.1836,5.20873
CFAI de SAVOIE (La Motte-Servolex - 73);45.5987,5.88592
CFA du CIRFAP (CENTRE INTER-REGIONAL DE FORMATION ALTERNEE DE LA PLASTURGIE) (Lyon 8e  Arrondissement - 69);45.7327,4.87684
Lycée Edmond Labbe (Douai - 59);50.3764,3.06851
Pôle formation UIMM Bretagne - CFA de l'Industrie BRUZ (35);48.0461,-1.7408
Lycée Jean Perrin (Marseille 10e  Arrondissement - 13);43.2746,5.42654
Lycée St Louis - Ste Marie (Gignac-la-Nerthe - 13);43.3953,5.23277
Lycée La Découverte (Decazeville - 12);44.5677,2.2524
CFA Jeanne d'Arc (Le Havre - 76);49.4979,0.10579
CFAI NORD FRANCHE COMTE (Exincourt - 25);47.501,6.84118
CFA AGROALIMENTAIRE MAMIROLLE (25);47.1969,6.16272
Roland Garros Lycée des métiers de la maintenance mécanique et de la productique (Toulouse - 31);43.6289,1.42937
LYCEE TECHNOLOGIQUE PRIVE ROBERT SCHUMAN (Dugny - 93);48.9493,2.41539
Lycée Ambroise Brugiere (Clermont-Ferrand - 63);45.8011,3.10765
Lycée Militaire d'Aix-en-Provence (13);43.527,5.45958
Lycée agricole François Pétrarque (Avignon - 84);43.9105,4.88321
CFA Régional des métiers Campus de Digne-les-Bains (04);44.1017,6.23609
Université Côte d'Azur (Nice - 06);43.7169,7.26729
Université de Limoges (87);45.8374,1.23451
Aix Marseille Université - Site d'Aix-en-Provence (13);43.5154,5.44724
Université de Tours (37);47.3561,0.70278
Lycée Saint Medard Inst N-D La Riche (Tours - 37);47.3926,0.677
Université de Poitiers (86);46.5856,0.34201
CFA MULTIMETIERS G.MAZAUBERT (Reignac - 33);45.2356,-0.51273
Université d'Amiens (80);49.8988,2.29936
Lycée La Providence (Amiens - 80);49.879,2.30104
Lycée professionnel privé Le Pinier Neuf (Beaupréau-en-Mauges - 49);47.1987,-1.00177
Aix-Marseille Université - Site de Marseille Colbert (Marseille  1er Arrondissement - 13);43.3004,5.37444
CNED (Lyon 4e  Arrondissement - 69);45.7797,4.82018
Lycée Costebelle (Hyères - 83);43.098,6.12533
Lycée polyvalent Leopold Elfort (Mana - 973);5.63833,-53.7067
Lycée professionnel Paul Painleve (Courbevoie - 92);48.8957,2.25795
Lycée Saint-Exupery (La Rochelle - 17);46.1569,-1.18157
CFAI Poitou-Charentes Campus CIPECMA (Châtelaillon-Plage - 17);46.0805,-1.08684
I.U.T de Béziers (34);43.3476,3.22234
Université Clermont Auvergne - Site de Vichy (03);46.1196,3.42526
Lycée Henri IV (Paris  5e  Arrondissement - 75);48.8463,2.34762
Lycée professionnel Olivier Guichard (Guérande - 44);47.3406,-2.42308
Université de Brest (29);48.392,-4.48844
Lycée Jean Jaures (Carmaux - 81);44.0456,2.13165
MFR Château Olonnes (Les Sables-d'Olonne - 85);46.4948,-1.76217
Lycée Les Trois Sources (Bourg-lès-Valence - 26);44.9554,4.90036
CFA-CCIV (Poitiers - 86);46.611,0.3461
CFA CCIP TECOMAH (Jouy-en-Josas - 78);48.7583,2.14504
Lycée Des métiers Jean DROUANT (Paris 17e  Arrondissement - 75);48.8807,2.30421
Lycée Marlioz (Aix-les-Bains - 73);45.6664,5.91194
Lycée professionnel Ducharmoy (Saint-Claude - 971);16.0181,-61.7155
Lycée agricole Convenance (Baie-Mahault - 971);16.2373,-61.599
CREPS de Bordeaux (Talence - 33);44.7984,-0.60049
CREPS de Strasbourg (67);48.5755,7.71082
CREPS Pays de la Loire - Antenne de Nantes (44);47.226,-1.52235
CREPS d'Ile de France - Antenne de Châtenay-Malabry (92);48.7654,2.2739
CREPS PACA - site d'Aix-en-Provence (13);43.5078,5.44529
Lycée des Métiers - Hotelier Raymond Mondon (Metz - 57);49.1055,6.20963
Lycée professionnel René Cassin (Metz - 57);49.1353,6.1684
Site de Avize du CFA agricole-viticole de la Marne (51);48.9754,4.02447
Lycée Alexandre Dumas (Hotelier) (Illkirch-Graffenstaden - 67);48.5285,7.71101
Université de Montpellier (34);43.6158,3.87204
CFAI Provence (Istres - 13);43.5028,4.9669
Lycée Jacques Duhamel (Dole - 39);47.0817,5.47086
Lycée des Métiers Marguerite Audoux (Gien - 45);47.7024,2.63368
Lycée Jean-Pierre Vernant (Sèvres - 92);48.8255,2.21153
Lycée Sainte Geneviève (Rennes - 35);48.0986,-1.68539
Lycée La Martinière-Diderot (Lyon 1er Arrondissement - 69);45.7679,4.82981
Lycée Camille Claudel (Vauréal - 95);49.033,2.0208
Lycée Joseph Savina (Tréguier - 22);48.7853,-3.23313
Lycée Le Paraclet (Quimper - 29);47.9951,-4.11407
Lycée Bréquigny (Rennes - 35);48.1173,-1.67779
Lycée Jules Verne (Sartrouville - 78);48.9428,2.16025
Lycée de la Communication Saint Géraud (Aurillac - 15);44.9316,2.44642
Lycée Hector Guimard (Lyon 7e  Arrondissement - 69);45.7457,4.85796
Lycée Rive Gauche (Toulouse - 31);43.5847,1.39421
Lycée Saint Etienne (Cahors - 46);44.4503,1.44138
SECTION ENSEIGNEMENT GENERAL ET TECHNOLOGIQUE CLEMENT DE PEMILLE (Graulhet - 81);43.765,1.99486
Lycée ST PIERRE-ST PAUL (Langogne - 48);44.7254,3.8537
Lycée Jean Monnet (Saint-Etienne - 42);45.4175,4.42119
Esaa Duperré (Paris  3e  Arrondissement - 75);48.8651,2.36204
POLE FORMATION UIMM OCCITANIE (CFAI) (Baillargues - 34);43.652,4.00216
Lycée Raymond Loewy (La Souterraine - 23);46.2399,1.48522
Lycée Paul Poiret (Paris 11e  Arrondissement - 75);48.8546,2.37492
Lycée Lucas De Nehou (Paris  5e  Arrondissement - 75);48.8415,2.34298
Lycée Estienne Esaig (Paris 13e  Arrondissement - 75);48.8308,2.35242
ECOLE NATIONALE SUPERIEURE A.A-MET.D'ART. (Paris 15e  Arrondissement - 75);48.8335,2.29483
Institut Catholique Paris (Paris  6e  Arrondissement - 75);48.8481,2.32917
I.U.T de Cergy-Pontoise - Site d'Argenteuil (95);48.9494,2.23342
CFA CFAI CENTRE (La Chapelle-Saint-Mesmin - 45);47.8889,1.83299
Institut supérieur du transport et de la logistique internationale (Marseille 14e  Arrondissement - 13);43.3346,5.37467
BTP CFA CHARENTE (Chasseneuil-sur-Bonnieure - 16);45.8211,0.45602
PROGRESS SANTE (Paris 10e  Arrondissement - 75);48.8791,2.36813
Lycée professionnel des Métiers Jean-Baptiste Clément (Sedan - 08);49.7353,4.83948
ANTENNE DE CFA CFA PROMOTRANS (Paris  9e  Arrondissement - 75);48.88,2.33058
Lycée professionnel Roger Claustres (Clermont-Ferrand - 63);45.7955,3.08771
Lycée Jean Dupuy (Tarbes - 65);43.2294,0.06526
Lycée professionnel Leonard De Vinci (Bressuire - 79);46.8336,-0.48784
Lycée du Gué-à-Tresmes (Congis-sur-Thérouanne - 77);49.0201,2.9643
Lycée Auguste Renoir (Paris 18e  Arrondissement - 75);48.8868,2.32809
Lycée Maximilien Vox (Paris  6e  Arrondissement - 75);48.8519,2.33206
Lycée Edgar Faure (Morteau - 25);47.0613,6.60695
CFA INST DES SERV A ENVIRONNEMENT (Lomme - 59);50.653,2.98362
ECOLE TECHNOLOGIQUE PRIVEE GRAND SUD FORMATION (Toulouse - 31);43.6077,1.45264
Lycée Saint Louis Saint Bruno (Lyon 1er Arrondissement - 69);45.7719,4.82323
Lycée professionnel La Trinite (972);14.6799,-60.96
Université Paris 13 (Villetaneuse - 93);48.9571,2.33972
Lycée professionnel des Métiers Eugene MONTEL (Colomiers - 31);43.6103,1.35157
Lycée professionnel Marcel Pagnol (Limoges - 87);45.8201,1.28607
Lycée professionnel Louise MICHEL (Ruffec - 16);46.0266,0.19276
Lycée Portes De L'Oisans (Vizille - 38);45.0675,5.76967
Institut Limayrac (Toulouse - 31);43.5928,1.46888
MFREO La Bagotière (Les Moutiers-en-Cinglais - 14);49.0293,-0.44803
CFA Campus IGS (Blagnac - 31);43.6436,1.38632
CFA INDUSTRIE MIDI-PYRENEES (Beauzelle - 31);43.6602,1.37346
Lycée Déodat de Séverac (Toulouse - 31);43.5884,1.42651
CFA UTEC MEAUX (77);48.9562,2.88847
Lycée Condorcet (Saint-Quentin - 02);49.8614,3.29328
CFA CAMAS (Tremblay-en-France - 93);48.967,2.57203
Lycée des métiers de la chimie Albert Camus (Mourenx - 64);43.3704,-0.62513
Lycée St Joseph De Cluny (Fort-de-France - 972);14.6141,-61.0815
Lycée professionnel des métiers Gabriel Voisin (Bourg-en-Bresse - 01);46.2113,5.24508
Lycée Colbert (Lyon 8e  Arrondissement - 69);45.745,4.85987
Lycée Dumont D'Urville (Maurepas - 78);48.7642,1.95217
Lycée professionnel Industries Lilloises (Lille - 59);50.6221,3.05722
Lycée Marcel Cachin (Saint-Ouen-sur-Seine - 93);48.9119,2.33376
Lycée Hyacinthe Friant (Poligny - 39);46.8348,5.7088
I.U.T de Nice - Antenne de Valbonne (06);43.61648,7.07206
I.U.T de Chalon-Sur-Saône (71);46.7771,4.85594
Lycée  Mémona Hintermann-Afféjee (Saint-Denis - 974);-20.91224,55.47906
Université Clermont Auvergne (Clermont-Ferrand - 63);45.7611,3.11138
Maison familiale et rurale (MFR) de Fougerolles (Fougerolles-Saint-Valbert - 70);47.8795,6.41671
BTP CFA INDRE ET CHER (Châteauroux - 36);46.78649,1.70441
ISEN Lille Cycle Préparatoire Numérique et Biologie (59);50.6342,3.04871
ESEO Dijon (21);47.3294,5.01709
ESCOM Chimie (Compiègne - 60);49.402,2.80244
ISEP Paris Cycle intégré international anglophone (Paris  6e  Arrondissement - 75);48.8456,2.32814
ESEO Paris - Vélizy (Vélizy-Villacoublay - 78);48.7836,2.21294
ESIEE Paris (Noisy-le-Grand - 93);48.83982,2.58357
ESAIP Cycle préparatoire Aix-en-Provence (13);43.5277,5.4042
ISEN Lille Cycle préparatoire numérique et biologie (59);50.6342,3.04871
ESEO Angers (49);47.4934,-0.5508
ISEN Lille Cycle préparatoire généraliste (59);50.6342,3.04871
HEI Lille Cycle préparatoire généraliste (59);50.6338,3.04505
ELISA Aerospace Hauts de France (Saint-Quentin - 02);49.8494,3.28716
Lycée Edouard Branly (Lyon 5e  Arrondissement - 69);45.7527,4.79112
MFREO La Palma à l'Arbresle (69);45.8391,4.62044
CFA AGRICOLE DE LA DORDOGNE (Coulounieix-Chamiers - 24);45.1724,0.69231
Lycée ORT Léon Bramson (Marseille 10e  Arrondissement - 13);43.2791,5.41043
Lycée Honoré d'Estienne d'Orves (Beau-Site) (Nice - 06);43.69804,7.24318
IFSI Beaujon René Auffray (AP-HP) - rentrée en septembre (Clichy - 92);48.9008,2.32915
IFSI CHS Roger Prevot - rentrée en septembre (Moisselles - 95);49.0503,2.33813
IFSI CH de Digne - rentrée en septembre (Digne-les-Bains - 04);44.0715,6.17487
IFSI du GCSPA d'Aix-en-Provence - rentrée en septembre (13);43.5199,5.4397
IFSI CH d'Aubagne - rentrée en septembre (13);43.2924,5.56285
IFSI du Gipes d'Avignon - rentrée en septembre (84);43.9093,4.88802
IFSI CH DU MANS  - rentrée en septembre (Le Mans - 72);48.016,0.17868
IFSI POLE SANTE SARTHE Et LOIR - rentrée en septembre (La Flèche - 72);47.7033,-0.06713
IFSI Avicenne (AP-HP) - rentrée en septembre (Bobigny - 93);48.91485,2.42129
IFSI EPS Ville Evrard - rentrée en septembre (Neuilly-sur-Marne - 93);48.86243,2.5454
IFSI Diaconesses Reuilly - rentrée en septembre (Paris 12e  Arrondissement - 75);48.84423,2.39193
IFSI CH La Palmosa de Menton - rentrée en septembre (06);43.7812,7.5086
Institut de Formation en Soins Infirmiers - SOISSONS - rentrée en septembre (02);49.36896,3.33568
IFSI CH Sens - rentrée en septembre (89);48.1928,3.29858
IFSI CH public du Cotentin - rentrée en septembre (Cherbourg-en-Cotentin - 50);49.6363,-1.61206
IFSI CH Montluçon - rentrée en septembre (03);46.3427,2.6118
IFSI CH du Puy - rentrée en septembre (Le Puy-en-Velay - 43);45.0507,3.87832
IFSI Bastia - rentrée en septembre (20);42.7068,9.45268
IFSI Sainte Marie Privas - rentrée en septembre (07);44.7318,4.59295
IFSI CH Dunkerque - rentrée en septembre (59);51.0364,2.40208
IFSI de l’Université Catholique de Lille - rentrée en septembre (Lomme - 59);50.65246,2.97128
IFSI Santélys Formation - rentrée en septembre (Loos - 59);50.6,3.03286
IFSI Croix Rouge Française Bethune - rentrée en septembre (62);50.5134,2.6488
IFSI Campus des Métiers de la Santé - Val de Lys Artois - rentrée en septembre (Saint-Venant - 62);50.6173,2.53819
IFSI CH de Brive - rentrée en septembre (Brive-la-Gaillarde - 19);45.16888,1.53372
IFSI J. LEPERCQ / CH ST JOSEPH ST LUC - rentrée en septembre (Lyon 7e  Arrondissement - 69);45.7469,4.83897
IFSI CH Le Vinatier  - rentrée en septembre (Bron - 69);45.7396,4.8934
IFSI CH de Carcassonne - rentrée en septembre (11);43.1874,2.34189
IFSI- Hospit. Privée - rentrée en septembre (Castelnau-le-Lez - 34);43.62384,3.91179
IFSI Briey - rentrée en septembre (Val de Briey - 54);49.2598,5.92815
IFSI Verdun - rentrée en septembre (55);49.1533,5.3802
IFSI CROIX ROUGE FRANCAISE Rezé - rentrée en septembre (44);47.1931,-1.54926
IFSI Tenon (AP-HP) - rentrée en septembre (Paris 20e  Arrondissement - 75);48.8662,2.40175
IFSI du CH Nord Deux-Sèvres Thouars - rentrée en septembre (79);46.9758,-0.2183
IFSI Charleville-Mezières - rentrée en septembre (08);49.7896,4.71882
IFSI Troyes - rentrée en septembre (10);48.27848,4.06706
IFSI Saint Dizier - rentrée en septembre (52);48.6566,4.96612
IFSI CH Dieppe - rentrée en septembre (76);49.9202,1.0789
IFSI Strasbourg (St Vincent) - rentrée en septembre (67);48.5612,7.74596
IFSI Croix Rouge Française Toulouse - rentrée en septembre (31);43.6054,1.38551
IFSI CH de Bigorre - rentrée en septembre (Tarbes - 65);43.22016,0.05635
IFSI CHIC Castres Mazamet - rentrée en septembre (81);43.6048,2.2461
IFSI CH de Dreux - rentrée en septembre (28);48.7281,1.37771
IFSI CH Montargis - rentrée en septembre (Châlette-sur-Loing - 45);48.0153,2.7312
IFSI Grand Hôpital Est Francilien - Site de Formation Serris - rentrée en septembre (77);48.8782,2.77421
Lycée de St Paul 4 (Saint-Paul - 974);-20.9794,55.3165
